Sheet: VLAN
B16: 1 | C16: =1+RC[-1] -> 2 | D16: =1+RC[-1] -> 3 | E16: =1+RC[-1] -> 4 | F16: =1+RC[-1] -> 5 | G16: =1+RC[-1] -> 6 | H16: =1+RC[-1] -> 7 | I16: =1+RC[-1] -> 8 | J16: =1+RC[-1] -> 9 | K16: =1+RC[-1] -> 10 | L16: =1+RC[-1] -> 11 | M16: =1+RC[-1] -> 12 | N16: =1+RC[-1] -> 13 | O16: =1+RC[-1] -> 14 | P16: =1+RC[-1] -> 15 | Q16: =1+RC[-1] -> 16 | R16: =1+RC[-1] -> 17 | S16: =1+RC[-1] -> 18 | T16: =1+RC[-1] -> 19 | U16: =1+RC[-1] -> 20 | V16: =1+RC[-1] -> 21 | W16: =1+RC[-1] -> 22 | X16: =1+RC[-1] -> 23 | Y16: =1+RC[-1] -> 24 | Z16: =1+RC[-1] -> 25 | AA16: =1+RC[-1] -> 26 | AB16: =1+RC[-1] -> 27 | AC16: =1+RC[-1] -> 28 | AD16: =1+RC[-1] -> 29 | AE16: =1+RC[-1] -> 30 | AF16: =1+RC[-1] -> 31 | AG16: =1+RC[-1] -> 32 | AH16: =1+RC[-1] -> 33 | AI16: =1+RC[-1] -> 34 | AJ16: =1+RC[-1] -> 35 | AK16: =1+RC[-1] -> 36 | AL16: =1+RC[-1] -> 37 | AM16: =1+RC[-1] -> 38 | AN16: =1+RC[-1] -> 39 | AO16: =1+RC[-1] -> 40 | AP16: =1+RC[-1] -> 41 | AQ16: =1+RC[-1] -> 42 | AR16: =1+RC[-1] -> 43 | AS16: =1+RC[-1] -> 44 | AT16: =1+RC[-1] -> 45 | AU16: =1+RC[-1] -> 46 | AV16: =1+RC[-1] -> 47 | AW16: =1+RC[-1] -> 48 | AX16: =1+RC[-1] -> 49 | AY16: =1+RC[-1] -> 50 | AZ16: =1+RC[-1] -> 51 | BA16: =1+RC[-1] -> 52 | BB16: =1+RC[-1] -> 53 | BC16: =1+RC[-1] -> 54 | BD16: =1+RC[-1] -> 55 | BE16: =1+RC[-1] -> 56 | BF16: =1+RC[-1] -> 57 | BG16: =1+RC[-1] -> 58 | BH16: =1+RC[-1] -> 59 | BI16: =1+RC[-1] -> 60 | BJ16: =1+RC[-1] -> 61 | BK16: =1+RC[-1] -> 62 | BL16: =1+RC[-1] -> 63 | BM16: =1+RC[-1] -> 64 | BN16: =1+RC[-1] -> 65 | BO16: =1+RC[-1] -> 66 | BP16: =1+RC[-1] -> 67 | BQ16: =1+RC[-1] -> 68 | BR16: =1+RC[-1] -> 69 | BS16: =1+RC[-1] -> 70 | BT16: =1+RC[-1] -> 71 | BU16: =1+RC[-1] -> 72 | BV16: =1+RC[-1] -> 73 | BW16: =1+RC[-1] -> 74 | BX16: =1+RC[-1] -> 75 | BY16: =1+RC[-1] -> 76 | BZ16: =1+RC[-1] -> 77 | CA16: =1+RC[-1] -> 78 | CB16: =1+RC[-1] -> 79 | CC16: =1+RC[-1] -> 80 | CD16: =1+RC[-1] -> 81 | CE16: =1+RC[-1] -> 82 | CF16: =1+RC[-1] -> 83 | CG16: =1+RC[-1] -> 84 | CH16: =1+RC[-1] -> 85 | CI16: =1+RC[-1] -> 86 | CJ16: =1+RC[-1] -> 87 | CK16: =1+RC[-1] -> 88 | CL16: =1+RC[-1] -> 89 | CM16: =1+RC[-1] -> 90 | CN16: =1+RC[-1] -> 91 | CO16: =1+RC[-1] -> 92 | CP16: =1+RC[-1] -> 93 | CQ16: =1+RC[-1] -> 94 | CR16: =1+RC[-1] -> 95 | CS16: =1+RC[-1] -> 96 | CT16: =1+RC[-1] -> 97 | CU16: =1+RC[-1] -> 98 | CV16: =1+RC[-1] -> 99 | CW16: =1+RC[-1] -> 100
B17: =R[-1]C[99]+1 -> 101 | C17: =1+RC[-1] -> 102 | D17: =1+RC[-1] -> 103 | E17: =1+RC[-1] -> 104 | F17: =1+RC[-1] -> 105 | G17: =1+RC[-1] -> 106 | H17: =1+RC[-1] -> 107 | I17: =1+RC[-1] -> 108 | J17: =1+RC[-1] -> 109 | K17: =1+RC[-1] -> 110 | L17: =1+RC[-1] -> 111 | M17: =1+RC[-1] -> 112 | N17: =1+RC[-1] -> 113 | O17: =1+RC[-1] -> 114 | P17: =1+RC[-1] -> 115 | Q17: =1+RC[-1] -> 116 | R17: =1+RC[-1] -> 117 | S17: =1+RC[-1] -> 118 | T17: =1+RC[-1] -> 119 | U17: =1+RC[-1] -> 120 | V17: =1+RC[-1] -> 121 | W17: =1+RC[-1] -> 122 | X17: =1+RC[-1] -> 123 | Y17: =1+RC[-1] -> 124 | Z17: =1+RC[-1] -> 125 | AA17: =1+RC[-1] -> 126 | AB17: =1+RC[-1] -> 127 | AC17: =1+RC[-1] -> 128 | AD17: =1+RC[-1] -> 129 | AE17: =1+RC[-1] -> 130 | AF17: =1+RC[-1] -> 131 | AG17: =1+RC[-1] -> 132 | AH17: =1+RC[-1] -> 133 | AI17: =1+RC[-1] -> 134 | AJ17: =1+RC[-1] -> 135 | AK17: =1+RC[-1] -> 136 | AL17: =1+RC[-1] -> 137 | AM17: =1+RC[-1] -> 138 | AN17: =1+RC[-1] -> 139 | AO17: =1+RC[-1] -> 140 | AP17: =1+RC[-1] -> 141 | AQ17: =1+RC[-1] -> 142 | AR17: =1+RC[-1] -> 143 | AS17: =1+RC[-1] -> 144 | AT17: =1+RC[-1] -> 145 | AU17: =1+RC[-1] -> 146 | AV17: =1+RC[-1] -> 147 | AW17: =1+RC[-1] -> 148 | AX17: =1+RC[-1] -> 149 | AY17: =1+RC[-1] -> 150 | AZ17: =1+RC[-1] -> 151 | BA17: =1+RC[-1] -> 152 | BB17: =1+RC[-1] -> 153 | BC17: =1+RC[-1] -> 154 | BD17: =1+RC[-1] -> 155 | BE17: =1+RC[-1] -> 156 | BF17: =1+RC[-1] -> 157 | BG17: =1+RC[-1] -> 158 | BH17: =1+RC[-1] -> 159 | BI17: =1+RC[-1] -> 160 | BJ17: =1+RC[-1] -> 161 | BK17: =1+RC[-1] -> 162 | BL17: =1+RC[-1] -> 163 | BM17: =1+RC[-1] -> 164 | BN17: =1+RC[-1] -> 165 | BO17: =1+RC[-1] -> 166 | BP17: =1+RC[-1] -> 167 | BQ17: =1+RC[-1] -> 168 | BR17: =1+RC[-1] -> 169 | BS17: =1+RC[-1] -> 170 | BT17: =1+RC[-1] -> 171 | BU17: =1+RC[-1] -> 172 | BV17: =1+RC[-1] -> 173 | BW17: =1+RC[-1] -> 174 | BX17: =1+RC[-1] -> 175 | BY17: =1+RC[-1] -> 176 | BZ17: =1+RC[-1] -> 177 | CA17: =1+RC[-1] -> 178 | CB17: =1+RC[-1] -> 179 | CC17: =1+RC[-1] -> 180 | CD17: =1+RC[-1] -> 181 | CE17: =1+RC[-1] -> 182 | CF17: =1+RC[-1] -> 183 | CG17: =1+RC[-1] -> 184 | CH17: =1+RC[-1] -> 185 | CI17: =1+RC[-1] -> 186 | CJ17: =1+RC[-1] -> 187 | CK17: =1+RC[-1] -> 188 | CL17: =1+RC[-1] -> 189 | CM17: =1+RC[-1] -> 190 | CN17: =1+RC[-1] -> 191 | CO17: =1+RC[-1] -> 192 | CP17: =1+RC[-1] -> 193 | CQ17: =1+RC[-1] -> 194 | CR17: =1+RC[-1] -> 195 | CS17: =1+RC[-1] -> 196 | CT17: =1+RC[-1] -> 197 | CU17: =1+RC[-1] -> 198 | CV17: =1+RC[-1] -> 199 | CW17: =1+RC[-1] -> 200
B18: =R[-1]C[99]+1 -> 201 | C18: =1+RC[-1] -> 202 | D18: =1+RC[-1] -> 203 | E18: =1+RC[-1] -> 204 | F18: =1+RC[-1] -> 205 | G18: =1+RC[-1] -> 206 | H18: =1+RC[-1] -> 207 | I18: =1+RC[-1] -> 208 | J18: =1+RC[-1] -> 209 | K18: =1+RC[-1] -> 210 | L18: =1+RC[-1] -> 211 | M18: =1+RC[-1] -> 212 | N18: =1+RC[-1] -> 213 | O18: =1+RC[-1] -> 214 | P18: =1+RC[-1] -> 215 | Q18: =1+RC[-1] -> 216 | R18: =1+RC[-1] -> 217 | S18: =1+RC[-1] -> 218 | T18: =1+RC[-1] -> 219 | U18: =1+RC[-1] -> 220 | V18: =1+RC[-1] -> 221 | W18: =1+RC[-1] -> 222 | X18: =1+RC[-1] -> 223 | Y18: =1+RC[-1] -> 224 | Z18: =1+RC[-1] -> 225 | AA18: =1+RC[-1] -> 226 | AB18: =1+RC[-1] -> 227 | AC18: =1+RC[-1] -> 228 | AD18: =1+RC[-1] -> 229 | AE18: =1+RC[-1] -> 230 | AF18: =1+RC[-1] -> 231 | AG18: =1+RC[-1] -> 232 | AH18: =1+RC[-1] -> 233 | AI18: =1+RC[-1] -> 234 | AJ18: =1+RC[-1] -> 235 | AK18: =1+RC[-1] -> 236 | AL18: =1+RC[-1] -> 237 | AM18: =1+RC[-1] -> 238 | AN18: =1+RC[-1] -> 239 | AO18: =1+RC[-1] -> 240 | AP18: =1+RC[-1] -> 241 | AQ18: =1+RC[-1] -> 242 | AR18: =1+RC[-1] -> 243 | AS18: =1+RC[-1] -> 244 | AT18: =1+RC[-1] -> 245 | AU18: =1+RC[-1] -> 246 | AV18: =1+RC[-1] -> 247 | AW18: =1+RC[-1] -> 248 | AX18: =1+RC[-1] -> 249 | AY18: =1+RC[-1] -> 250 | AZ18: =1+RC[-1] -> 251 | BA18: =1+RC[-1] -> 252 | BB18: =1+RC[-1] -> 253 | BC18: =1+RC[-1] -> 254 | BD18: =1+RC[-1] -> 255 | BE18: =1+RC[-1] -> 256 | BF18: =1+RC[-1] -> 257 | BG18: =1+RC[-1] -> 258 | BH18: =1+RC[-1] -> 259 | BI18: =1+RC[-1] -> 260 | BJ18: =1+RC[-1] -> 261 | BK18: =1+RC[-1] -> 262 | BL18: =1+RC[-1] -> 263 | BM18: =1+RC[-1] -> 264 | BN18: =1+RC[-1] -> 265 | BO18: =1+RC[-1] -> 266 | BP18: =1+RC[-1] -> 267 | BQ18: =1+RC[-1] -> 268 | BR18: =1+RC[-1] -> 269 | BS18: =1+RC[-1] -> 270 | BT18: =1+RC[-1] -> 271 | BU18: =1+RC[-1] -> 272 | BV18: =1+RC[-1] -> 273 | BW18: =1+RC[-1] -> 274 | BX18: =1+RC[-1] -> 275 | BY18: =1+RC[-1] -> 276 | BZ18: =1+RC[-1] -> 277 | CA18: =1+RC[-1] -> 278 | CB18: =1+RC[-1] -> 279 | CC18: =1+RC[-1] -> 280 | CD18: =1+RC[-1] -> 281 | CE18: =1+RC[-1] -> 282 | CF18: =1+RC[-1] -> 283 | CG18: =1+RC[-1] -> 284 | CH18: =1+RC[-1] -> 285 | CI18: =1+RC[-1] -> 286 | CJ18: =1+RC[-1] -> 287 | CK18: =1+RC[-1] -> 288 | CL18: =1+RC[-1] -> 289 | CM18: =1+RC[-1] -> 290 | CN18: =1+RC[-1] -> 291 | CO18: =1+RC[-1] -> 292 | CP18: =1+RC[-1] -> 293 | CQ18: =1+RC[-1] -> 294 | CR18: =1+RC[-1] -> 295 | CS18: =1+RC[-1] -> 296 | CT18: =1+RC[-1] -> 297 | CU18: =1+RC[-1] -> 298 | CV18: =1+RC[-1] -> 299 | CW18: =1+RC[-1] -> 300
B19: =R[-1]C[99]+1 -> 301 | C19: =1+RC[-1] -> 302 | D19: =1+RC[-1] -> 303 | E19: =1+RC[-1] -> 304 | F19: =1+RC[-1] -> 305 | G19: =1+RC[-1] -> 306 | H19: =1+RC[-1] -> 307 | I19: =1+RC[-1] -> 308 | J19: =1+RC[-1] -> 309 | K19: =1+RC[-1] -> 310 | L19: =1+RC[-1] -> 311 | M19: =1+RC[-1] -> 312 | N19: =1+RC[-1] -> 313 | O19: =1+RC[-1] -> 314 | P19: =1+RC[-1] -> 315 | Q19: =1+RC[-1] -> 316 | R19: =1+RC[-1] -> 317 | S19: =1+RC[-1] -> 318 | T19: =1+RC[-1] -> 319 | U19: =1+RC[-1] -> 320 | V19: =1+RC[-1] -> 321 | W19: =1+RC[-1] -> 322 | X19: =1+RC[-1] -> 323 | Y19: =1+RC[-1] -> 324 | Z19: =1+RC[-1] -> 325 | AA19: =1+RC[-1] -> 326 | AB19: =1+RC[-1] -> 327 | AC19: =1+RC[-1] -> 328 | AD19: =1+RC[-1] -> 329 | AE19: =1+RC[-1] -> 330 | AF19: =1+RC[-1] -> 331 | AG19: =1+RC[-1] -> 332 | AH19: =1+RC[-1] -> 333 | AI19: =1+RC[-1] -> 334 | AJ19: =1+RC[-1] -> 335 | AK19: =1+RC[-1] -> 336 | AL19: =1+RC[-1] -> 337 | AM19: =1+RC[-1] -> 338 | AN19: =1+RC[-1] -> 339 | AO19: =1+RC[-1] -> 340 | AP19: =1+RC[-1] -> 341 | AQ19: =1+RC[-1] -> 342 | AR19: =1+RC[-1] -> 343 | AS19: =1+RC[-1] -> 344 | AT19: =1+RC[-1] -> 345 | AU19: =1+RC[-1] -> 346 | AV19: =1+RC[-1] -> 347 | AW19: =1+RC[-1] -> 348 | AX19: =1+RC[-1] -> 349 | AY19: =1+RC[-1] -> 350 | AZ19: =1+RC[-1] -> 351 | BA19: =1+RC[-1] -> 352 | BB19: =1+RC[-1] -> 353 | BC19: =1+RC[-1] -> 354 | BD19: =1+RC[-1] -> 355 | BE19: =1+RC[-1] -> 356 | BF19: =1+RC[-1] -> 357 | BG19: =1+RC[-1] -> 358 | BH19: =1+RC[-1] -> 359 | BI19: =1+RC[-1] -> 360 | BJ19: =1+RC[-1] -> 361 | BK19: =1+RC[-1] -> 362 | BL19: =1+RC[-1] -> 363 | BM19: =1+RC[-1] -> 364 | BN19: =1+RC[-1] -> 365 | BO19: =1+RC[-1] -> 366 | BP19: =1+RC[-1] -> 367 | BQ19: =1+RC[-1] -> 368 | BR19: =1+RC[-1] -> 369 | BS19: =1+RC[-1] -> 370 | BT19: =1+RC[-1] -> 371 | BU19: =1+RC[-1] -> 372 | BV19: =1+RC[-1] -> 373 | BW19: =1+RC[-1] -> 374 | BX19: =1+RC[-1] -> 375 | BY19: =1+RC[-1] -> 376 | BZ19: =1+RC[-1] -> 377 | CA19: =1+RC[-1] -> 378 | CB19: =1+RC[-1] -> 379 | CC19: =1+RC[-1] -> 380 | CD19: =1+RC[-1] -> 381 | CE19: =1+RC[-1] -> 382 | CF19: =1+RC[-1] -> 383 | CG19: =1+RC[-1] -> 384 | CH19: =1+RC[-1] -> 385 | CI19: =1+RC[-1] -> 386 | CJ19: =1+RC[-1] -> 387 | CK19: =1+RC[-1] -> 388 | CL19: =1+RC[-1] -> 389 | CM19: =1+RC[-1] -> 390 | CN19: =1+RC[-1] -> 391 | CO19: =1+RC[-1] -> 392 | CP19: =1+RC[-1] -> 393 | CQ19: =1+RC[-1] -> 394 | CR19: =1+RC[-1] -> 395 | CS19: =1+RC[-1] -> 396 | CT19: =1+RC[-1] -> 397 | CU19: =1+RC[-1] -> 398 | CV19: =1+RC[-1] -> 399 | CW19: =1+RC[-1] -> 400
B20: =R[-1]C[99]+1 -> 401 | C20: =1+RC[-1] -> 402 | D20: =1+RC[-1] -> 403 | E20: =1+RC[-1] -> 404 | F20: =1+RC[-1] -> 405 | G20: =1+RC[-1] -> 406 | H20: =1+RC[-1] -> 407 | I20: =1+RC[-1] -> 408 | J20: =1+RC[-1] -> 409 | K20: =1+RC[-1] -> 410 | L20: =1+RC[-1] -> 411 | M20: =1+RC[-1] -> 412 | N20: =1+RC[-1] -> 413 | O20: =1+RC[-1] -> 414 | P20: =1+RC[-1] -> 415 | Q20: =1+RC[-1] -> 416 | R20: =1+RC[-1] -> 417 | S20: =1+RC[-1] -> 418 | T20: =1+RC[-1] -> 419 | U20: =1+RC[-1] -> 420 | V20: =1+RC[-1] -> 421 | W20: =1+RC[-1] -> 422 | X20: =1+RC[-1] -> 423 | Y20: =1+RC[-1] -> 424 | Z20: =1+RC[-1] -> 425 | AA20: =1+RC[-1] -> 426 | AB20: =1+RC[-1] -> 427 | AC20: =1+RC[-1] -> 428 | AD20: =1+RC[-1] -> 429 | AE20: =1+RC[-1] -> 430 | AF20: =1+RC[-1] -> 431 | AG20: =1+RC[-1] -> 432 | AH20: =1+RC[-1] -> 433 | AI20: =1+RC[-1] -> 434 | AJ20: =1+RC[-1] -> 435 | AK20: =1+RC[-1] -> 436 | AL20: =1+RC[-1] -> 437 | AM20: =1+RC[-1] -> 438 | AN20: =1+RC[-1] -> 439 | AO20: =1+RC[-1] -> 440 | AP20: =1+RC[-1] -> 441 | AQ20: =1+RC[-1] -> 442 | AR20: =1+RC[-1] -> 443 | AS20: =1+RC[-1] -> 444 | AT20: =1+RC[-1] -> 445 | AU20: =1+RC[-1] -> 446 | AV20: =1+RC[-1] -> 447 | AW20: =1+RC[-1] -> 448 | AX20: =1+RC[-1] -> 449 | AY20: =1+RC[-1] -> 450 | AZ20: =1+RC[-1] -> 451 | BA20: =1+RC[-1] -> 452 | BB20: =1+RC[-1] -> 453 | BC20: =1+RC[-1] -> 454 | BD20: =1+RC[-1] -> 455 | BE20: =1+RC[-1] -> 456 | BF20: =1+RC[-1] -> 457 | BG20: =1+RC[-1] -> 458 | BH20: =1+RC[-1] -> 459 | BI20: =1+RC[-1] -> 460 | BJ20: =1+RC[-1] -> 461 | BK20: =1+RC[-1] -> 462 | BL20: =1+RC[-1] -> 463 | BM20: =1+RC[-1] -> 464 | BN20: =1+RC[-1] -> 465 | BO20: =1+RC[-1] -> 466 | BP20: =1+RC[-1] -> 467 | BQ20: =1+RC[-1] -> 468 | BR20: =1+RC[-1] -> 469 | BS20: =1+RC[-1] -> 470 | BT20: =1+RC[-1] -> 471 | BU20: =1+RC[-1] -> 472 | BV20: =1+RC[-1] -> 473 | BW20: =1+RC[-1] -> 474 | BX20: =1+RC[-1] -> 475 | BY20: =1+RC[-1] -> 476 | BZ20: =1+RC[-1] -> 477 | CA20: =1+RC[-1] -> 478 | CB20: =1+RC[-1] -> 479 | CC20: =1+RC[-1] -> 480 | CD20: =1+RC[-1] -> 481 | CE20: =1+RC[-1] -> 482 | CF20: =1+RC[-1] -> 483 | CG20: =1+RC[-1] -> 484 | CH20: =1+RC[-1] -> 485 | CI20: =1+RC[-1] -> 486 | CJ20: =1+RC[-1] -> 487 | CK20: =1+RC[-1] -> 488 | CL20: =1+RC[-1] -> 489 | CM20: =1+RC[-1] -> 490 | CN20: =1+RC[-1] -> 491 | CO20: =1+RC[-1] -> 492 | CP20: =1+RC[-1] -> 493 | CQ20: =1+RC[-1] -> 494 | CR20: =1+RC[-1] -> 495 | CS20: =1+RC[-1] -> 496 | CT20: =1+RC[-1] -> 497 | CU20: =1+RC[-1] -> 498 | CV20: =1+RC[-1] -> 499 | CW20: =1+RC[-1] -> 500
B21: =R[-1]C[99]+1 -> 501 | C21: =1+RC[-1] -> 502 | D21: =1+RC[-1] -> 503 | E21: =1+RC[-1] -> 504 | F21: =1+RC[-1] -> 505 | G21: =1+RC[-1] -> 506 | H21: =1+RC[-1] -> 507 | I21: =1+RC[-1] -> 508 | J21: =1+RC[-1] -> 509 | K21: =1+RC[-1] -> 510 | L21: =1+RC[-1] -> 511 | M21: =1+RC[-1] -> 512 | N21: =1+RC[-1] -> 513 | O21: =1+RC[-1] -> 514 | P21: =1+RC[-1] -> 515 | Q21: =1+RC[-1] -> 516 | R21: =1+RC[-1] -> 517 | S21: =1+RC[-1] -> 518 | T21: =1+RC[-1] -> 519 | U21: =1+RC[-1] -> 520 | V21: =1+RC[-1] -> 521 | W21: =1+RC[-1] -> 522 | X21: =1+RC[-1] -> 523 | Y21: =1+RC[-1] -> 524 | Z21: =1+RC[-1] -> 525 | AA21: =1+RC[-1] -> 526 | AB21: =1+RC[-1] -> 527 | AC21: =1+RC[-1] -> 528 | AD21: =1+RC[-1] -> 529 | AE21: =1+RC[-1] -> 530 | AF21: =1+RC[-1] -> 531 | AG21: =1+RC[-1] -> 532 | AH21: =1+RC[-1] -> 533 | AI21: =1+RC[-1] -> 534 | AJ21: =1+RC[-1] -> 535 | AK21: =1+RC[-1] -> 536 | AL21: =1+RC[-1] -> 537 | AM21: =1+RC[-1] -> 538 | AN21: =1+RC[-1] -> 539 | AO21: =1+RC[-1] -> 540 | AP21: =1+RC[-1] -> 541 | AQ21: =1+RC[-1] -> 542 | AR21: =1+RC[-1] -> 543 | AS21: =1+RC[-1] -> 544 | AT21: =1+RC[-1] -> 545 | AU21: =1+RC[-1] -> 546 | AV21: =1+RC[-1] -> 547 | AW21: =1+RC[-1] -> 548 | AX21: =1+RC[-1] -> 549 | AY21: =1+RC[-1] -> 550 | AZ21: =1+RC[-1] -> 551 | BA21: =1+RC[-1] -> 552 | BB21: =1+RC[-1] -> 553 | BC21: =1+RC[-1] -> 554 | BD21: =1+RC[-1] -> 555 | BE21: =1+RC[-1] -> 556 | BF21: =1+RC[-1] -> 557 | BG21: =1+RC[-1] -> 558 | BH21: =1+RC[-1] -> 559 | BI21: =1+RC[-1] -> 560 | BJ21: =1+RC[-1] -> 561 | BK21: =1+RC[-1] -> 562 | BL21: =1+RC[-1] -> 563 | BM21: =1+RC[-1] -> 564 | BN21: =1+RC[-1] -> 565 | BO21: =1+RC[-1] -> 566 | BP21: =1+RC[-1] -> 567 | BQ21: =1+RC[-1] -> 568 | BR21: =1+RC[-1] -> 569 | BS21: =1+RC[-1] -> 570 | BT21: =1+RC[-1] -> 571 | BU21: =1+RC[-1] -> 572 | BV21: =1+RC[-1] -> 573 | BW21: =1+RC[-1] -> 574 | BX21: =1+RC[-1] -> 575 | BY21: =1+RC[-1] -> 576 | BZ21: =1+RC[-1] -> 577 | CA21: =1+RC[-1] -> 578 | CB21: =1+RC[-1] -> 579 | CC21: =1+RC[-1] -> 580 | CD21: =1+RC[-1] -> 581 | CE21: =1+RC[-1] -> 582 | CF21: =1+RC[-1] -> 583 | CG21: =1+RC[-1] -> 584 | CH21: =1+RC[-1] -> 585 | CI21: =1+RC[-1] -> 586 | CJ21: =1+RC[-1] -> 587 | CK21: =1+RC[-1] -> 588 | CL21: =1+RC[-1] -> 589 | CM21: =1+RC[-1] -> 590 | CN21: =1+RC[-1] -> 591 | CO21: =1+RC[-1] -> 592 | CP21: =1+RC[-1] -> 593 | CQ21: =1+RC[-1] -> 594 | CR21: =1+RC[-1] -> 595 | CS21: =1+RC[-1] -> 596 | CT21: =1+RC[-1] -> 597 | CU21: =1+RC[-1] -> 598 | CV21: =1+RC[-1] -> 599 | CW21: =1+RC[-1] -> 600
B22: =R[-1]C[99]+1 -> 601 | C22: =1+RC[-1] -> 602 | D22: =1+RC[-1] -> 603 | E22: =1+RC[-1] -> 604 | F22: =1+RC[-1] -> 605 | G22: =1+RC[-1] -> 606 | H22: =1+RC[-1] -> 607 | I22: =1+RC[-1] -> 608 | J22: =1+RC[-1] -> 609 | K22: =1+RC[-1] -> 610 | L22: =1+RC[-1] -> 611 | M22: =1+RC[-1] -> 612 | N22: =1+RC[-1] -> 613 | O22: =1+RC[-1] -> 614 | P22: =1+RC[-1] -> 615 | Q22: =1+RC[-1] -> 616 | R22: =1+RC[-1] -> 617 | S22: =1+RC[-1] -> 618 | T22: =1+RC[-1] -> 619 | U22: =1+RC[-1] -> 620 | V22: =1+RC[-1] -> 621 | W22: =1+RC[-1] -> 622 | X22: =1+RC[-1] -> 623 | Y22: =1+RC[-1] -> 624 | Z22: =1+RC[-1] -> 625 | AA22: =1+RC[-1] -> 626 | AB22: =1+RC[-1] -> 627 | AC22: =1+RC[-1] -> 628 | AD22: =1+RC[-1] -> 629 | AE22: =1+RC[-1] -> 630 | AF22: =1+RC[-1] -> 631 | AG22: =1+RC[-1] -> 632 | AH22: =1+RC[-1] -> 633 | AI22: =1+RC[-1] -> 634 | AJ22: =1+RC[-1] -> 635 | AK22: =1+RC[-1] -> 636 | AL22: =1+RC[-1] -> 637 | AM22: =1+RC[-1] -> 638 | AN22: =1+RC[-1] -> 639 | AO22: =1+RC[-1] -> 640 | AP22: =1+RC[-1] -> 641 | AQ22: =1+RC[-1] -> 642 | AR22: =1+RC[-1] -> 643 | AS22: =1+RC[-1] -> 644 | AT22: =1+RC[-1] -> 645 | AU22: =1+RC[-1] -> 646 | AV22: =1+RC[-1] -> 647 | AW22: =1+RC[-1] -> 648 | AX22: =1+RC[-1] -> 649 | AY22: =1+RC[-1] -> 650 | AZ22: =1+RC[-1] -> 651 | BA22: =1+RC[-1] -> 652 | BB22: =1+RC[-1] -> 653 | BC22: =1+RC[-1] -> 654 | BD22: =1+RC[-1] -> 655 | BE22: =1+RC[-1] -> 656 | BF22: =1+RC[-1] -> 657 | BG22: =1+RC[-1] -> 658 | BH22: =1+RC[-1] -> 659 | BI22: =1+RC[-1] -> 660 | BJ22: =1+RC[-1] -> 661 | BK22: =1+RC[-1] -> 662 | BL22: =1+RC[-1] -> 663 | BM22: =1+RC[-1] -> 664 | BN22: =1+RC[-1] -> 665 | BO22: =1+RC[-1] -> 666 | BP22: =1+RC[-1] -> 667 | BQ22: =1+RC[-1] -> 668 | BR22: =1+RC[-1] -> 669 | BS22: =1+RC[-1] -> 670 | BT22: =1+RC[-1] -> 671 | BU22: =1+RC[-1] -> 672 | BV22: =1+RC[-1] -> 673 | BW22: =1+RC[-1] -> 674 | BX22: =1+RC[-1] -> 675 | BY22: =1+RC[-1] -> 676 | BZ22: =1+RC[-1] -> 677 | CA22: =1+RC[-1] -> 678 | CB22: =1+RC[-1] -> 679 | CC22: =1+RC[-1] -> 680 | CD22: =1+RC[-1] -> 681 | CE22: =1+RC[-1] -> 682 | CF22: =1+RC[-1] -> 683 | CG22: =1+RC[-1] -> 684 | CH22: =1+RC[-1] -> 685 | CI22: =1+RC[-1] -> 686 | CJ22: =1+RC[-1] -> 687 | CK22: =1+RC[-1] -> 688 | CL22: =1+RC[-1] -> 689 | CM22: =1+RC[-1] -> 690 | CN22: =1+RC[-1] -> 691 | CO22: =1+RC[-1] -> 692 | CP22: =1+RC[-1] -> 693 | CQ22: =1+RC[-1] -> 694 | CR22: =1+RC[-1] -> 695 | CS22: =1+RC[-1] -> 696 | CT22: =1+RC[-1] -> 697 | CU22: =1+RC[-1] -> 698 | CV22: =1+RC[-1] -> 699 | CW22: =1+RC[-1] -> 700
B23: =R[-1]C[99]+1 -> 701 | C23: =1+RC[-1] -> 702 | D23: =1+RC[-1] -> 703 | E23: =1+RC[-1] -> 704 | F23: =1+RC[-1] -> 705 | G23: =1+RC[-1] -> 706 | H23: =1+RC[-1] -> 707 | I23: =1+RC[-1] -> 708 | J23: =1+RC[-1] -> 709 | K23: =1+RC[-1] -> 710 | L23: =1+RC[-1] -> 711 | M23: =1+RC[-1] -> 712 | N23: =1+RC[-1] -> 713 | O23: =1+RC[-1] -> 714 | P23: =1+RC[-1] -> 715 | Q23: =1+RC[-1] -> 716 | R23: =1+RC[-1] -> 717 | S23: =1+RC[-1] -> 718 | T23: =1+RC[-1] -> 719 | U23: =1+RC[-1] -> 720 | V23: =1+RC[-1] -> 721 | W23: =1+RC[-1] -> 722 | X23: =1+RC[-1] -> 723 | Y23: =1+RC[-1] -> 724 | Z23: =1+RC[-1] -> 725 | AA23: =1+RC[-1] -> 726 | AB23: =1+RC[-1] -> 727 | AC23: =1+RC[-1] -> 728 | AD23: =1+RC[-1] -> 729 | AE23: =1+RC[-1] -> 730 | AF23: =1+RC[-1] -> 731 | AG23: =1+RC[-1] -> 732 | AH23: =1+RC[-1] -> 733 | AI23: =1+RC[-1] -> 734 | AJ23: =1+RC[-1] -> 735 | AK23: =1+RC[-1] -> 736 | AL23: =1+RC[-1] -> 737 | AM23: =1+RC[-1] -> 738 | AN23: =1+RC[-1] -> 739 | AO23: =1+RC[-1] -> 740 | AP23: =1+RC[-1] -> 741 | AQ23: =1+RC[-1] -> 742 | AR23: =1+RC[-1] -> 743 | AS23: =1+RC[-1] -> 744 | AT23: =1+RC[-1] -> 745 | AU23: =1+RC[-1] -> 746 | AV23: =1+RC[-1] -> 747 | AW23: =1+RC[-1] -> 748 | AX23: =1+RC[-1] -> 749 | AY23: =1+RC[-1] -> 750 | AZ23: =1+RC[-1] -> 751 | BA23: =1+RC[-1] -> 752 | BB23: =1+RC[-1] -> 753 | BC23: =1+RC[-1] -> 754 | BD23: =1+RC[-1] -> 755 | BE23: =1+RC[-1] -> 756 | BF23: =1+RC[-1] -> 757 | BG23: =1+RC[-1] -> 758 | BH23: =1+RC[-1] -> 759 | BI23: =1+RC[-1] -> 760 | BJ23: =1+RC[-1] -> 761 | BK23: =1+RC[-1] -> 762 | BL23: =1+RC[-1] -> 763 | BM23: =1+RC[-1] -> 764 | BN23: =1+RC[-1] -> 765 | BO23: =1+RC[-1] -> 766 | BP23: =1+RC[-1] -> 767 | BQ23: =1+RC[-1] -> 768 | BR23: =1+RC[-1] -> 769 | BS23: =1+RC[-1] -> 770 | BT23: =1+RC[-1] -> 771 | BU23: =1+RC[-1] -> 772 | BV23: =1+RC[-1] -> 773 | BW23: =1+RC[-1] -> 774 | BX23: =1+RC[-1] -> 775 | BY23: =1+RC[-1] -> 776 | BZ23: =1+RC[-1] -> 777 | CA23: =1+RC[-1] -> 778 | CB23: =1+RC[-1] -> 779 | CC23: =1+RC[-1] -> 780 | CD23: =1+RC[-1] -> 781 | CE23: =1+RC[-1] -> 782 | CF23: =1+RC[-1] -> 783 | CG23: =1+RC[-1] -> 784 | CH23: =1+RC[-1] -> 785 | CI23: =1+RC[-1] -> 786 | CJ23: =1+RC[-1] -> 787 | CK23: =1+RC[-1] -> 788 | CL23: =1+RC[-1] -> 789 | CM23: =1+RC[-1] -> 790 | CN23: =1+RC[-1] -> 791 | CO23: =1+RC[-1] -> 792 | CP23: =1+RC[-1] -> 793 | CQ23: =1+RC[-1] -> 794 | CR23: =1+RC[-1] -> 795 | CS23: =1+RC[-1] -> 796 | CT23: =1+RC[-1] -> 797 | CU23: =1+RC[-1] -> 798 | CV23: =1+RC[-1] -> 799 | CW23: =1+RC[-1] -> 800
B24: =R[-1]C[99]+1 -> 801 | C24: =1+RC[-1] -> 802 | D24: =1+RC[-1] -> 803 | E24: =1+RC[-1] -> 804 | F24: =1+RC[-1] -> 805 | G24: =1+RC[-1] -> 806 | H24: =1+RC[-1] -> 807 | I24: =1+RC[-1] -> 808 | J24: =1+RC[-1] -> 809 | K24: =1+RC[-1] -> 810 | L24: =1+RC[-1] -> 811 | M24: =1+RC[-1] -> 812 | N24: =1+RC[-1] -> 813 | O24: =1+RC[-1] -> 814 | P24: =1+RC[-1] -> 815 | Q24: =1+RC[-1] -> 816 | R24: =1+RC[-1] -> 817 | S24: =1+RC[-1] -> 818 | T24: =1+RC[-1] -> 819 | U24: =1+RC[-1] -> 820 | V24: =1+RC[-1] -> 821 | W24: =1+RC[-1] -> 822 | X24: =1+RC[-1] -> 823 | Y24: =1+RC[-1] -> 824 | Z24: =1+RC[-1] -> 825 | AA24: =1+RC[-1] -> 826 | AB24: =1+RC[-1] -> 827 | AC24: =1+RC[-1] -> 828 | AD24: =1+RC[-1] -> 829 | AE24: =1+RC[-1] -> 830 | AF24: =1+RC[-1] -> 831 | AG24: =1+RC[-1] -> 832 | AH24: =1+RC[-1] -> 833 | AI24: =1+RC[-1] -> 834 | AJ24: =1+RC[-1] -> 835 | AK24: =1+RC[-1] -> 836 | AL24: =1+RC[-1] -> 837 | AM24: =1+RC[-1] -> 838 | AN24: =1+RC[-1] -> 839 | AO24: =1+RC[-1] -> 840 | AP24: =1+RC[-1] -> 841 | AQ24: =1+RC[-1] -> 842 | AR24: =1+RC[-1] -> 843 | AS24: =1+RC[-1] -> 844 | AT24: =1+RC[-1] -> 845 | AU24: =1+RC[-1] -> 846 | AV24: =1+RC[-1] -> 847 | AW24: =1+RC[-1] -> 848 | AX24: =1+RC[-1] -> 849 | AY24: =1+RC[-1] -> 850 | AZ24: =1+RC[-1] -> 851 | BA24: =1+RC[-1] -> 852 | BB24: =1+RC[-1] -> 853 | BC24: =1+RC[-1] -> 854 | BD24: =1+RC[-1] -> 855 | BE24: =1+RC[-1] -> 856 | BF24: =1+RC[-1] -> 857 | BG24: =1+RC[-1] -> 858 | BH24: =1+RC[-1] -> 859 | BI24: =1+RC[-1] -> 860 | BJ24: =1+RC[-1] -> 861 | BK24: =1+RC[-1] -> 862 | BL24: =1+RC[-1] -> 863 | BM24: =1+RC[-1] -> 864 | BN24: =1+RC[-1] -> 865 | BO24: =1+RC[-1] -> 866 | BP24: =1+RC[-1] -> 867 | BQ24: =1+RC[-1] -> 868 | BR24: =1+RC[-1] -> 869 | BS24: =1+RC[-1] -> 870 | BT24: =1+RC[-1] -> 871 | BU24: =1+RC[-1] -> 872 | BV24: =1+RC[-1] -> 873 | BW24: =1+RC[-1] -> 874 | BX24: =1+RC[-1] -> 875 | BY24: =1+RC[-1] -> 876 | BZ24: =1+RC[-1] -> 877 | CA24: =1+RC[-1] -> 878 | CB24: =1+RC[-1] -> 879 | CC24: =1+RC[-1] -> 880 | CD24: =1+RC[-1] -> 881 | CE24: =1+RC[-1] -> 882 | CF24: =1+RC[-1] -> 883 | CG24: =1+RC[-1] -> 884 | CH24: =1+RC[-1] -> 885 | CI24: =1+RC[-1] -> 886 | CJ24: =1+RC[-1] -> 887 | CK24: =1+RC[-1] -> 888 | CL24: =1+RC[-1] -> 889 | CM24: =1+RC[-1] -> 890 | CN24: =1+RC[-1] -> 891 | CO24: =1+RC[-1] -> 892 | CP24: =1+RC[-1] -> 893 | CQ24: =1+RC[-1] -> 894 | CR24: =1+RC[-1] -> 895 | CS24: =1+RC[-1] -> 896 | CT24: =1+RC[-1] -> 897 | CU24: =1+RC[-1] -> 898 | CV24: =1+RC[-1] -> 899 | CW24: =1+RC[-1] -> 900
B25: =R[-1]C[99]+1 -> 901 | C25: =1+RC[-1] -> 902 | D25: =1+RC[-1] -> 903 | E25: =1+RC[-1] -> 904 | F25: =1+RC[-1] -> 905 | G25: =1+RC[-1] -> 906 | H25: =1+RC[-1] -> 907 | I25: =1+RC[-1] -> 908 | J25: =1+RC[-1] -> 909 | K25: =1+RC[-1] -> 910 | L25: =1+RC[-1] -> 911 | M25: =1+RC[-1] -> 912 | N25: =1+RC[-1] -> 913 | O25: =1+RC[-1] -> 914 | P25: =1+RC[-1] -> 915 | Q25: =1+RC[-1] -> 916 | R25: =1+RC[-1] -> 917 | S25: =1+RC[-1] -> 918 | T25: =1+RC[-1] -> 919 | U25: =1+RC[-1] -> 920 | V25: =1+RC[-1] -> 921 | W25: =1+RC[-1] -> 922 | X25: =1+RC[-1] -> 923 | Y25: =1+RC[-1] -> 924 | Z25: =1+RC[-1] -> 925 | AA25: =1+RC[-1] -> 926 | AB25: =1+RC[-1] -> 927 | AC25: =1+RC[-1] -> 928 | AD25: =1+RC[-1] -> 929 | AE25: =1+RC[-1] -> 930 | AF25: =1+RC[-1] -> 931 | AG25: =1+RC[-1] -> 932 | AH25: =1+RC[-1] -> 933 | AI25: =1+RC[-1] -> 934 | AJ25: =1+RC[-1] -> 935 | AK25: =1+RC[-1] -> 936 | AL25: =1+RC[-1] -> 937 | AM25: =1+RC[-1] -> 938 | AN25: =1+RC[-1] -> 939 | AO25: =1+RC[-1] -> 940 | AP25: =1+RC[-1] -> 941 | AQ25: =1+RC[-1] -> 942 | AR25: =1+RC[-1] -> 943 | AS25: =1+RC[-1] -> 944 | AT25: =1+RC[-1] -> 945 | AU25: =1+RC[-1] -> 946 | AV25: =1+RC[-1] -> 947 | AW25: =1+RC[-1] -> 948 | AX25: =1+RC[-1] -> 949 | AY25: =1+RC[-1] -> 950 | AZ25: =1+RC[-1] -> 951 | BA25: =1+RC[-1] -> 952 | BB25: =1+RC[-1] -> 953 | BC25: =1+RC[-1] -> 954 | BD25: =1+RC[-1] -> 955 | BE25: =1+RC[-1] -> 956 | BF25: =1+RC[-1] -> 957 | BG25: =1+RC[-1] -> 958 | BH25: =1+RC[-1] -> 959 | BI25: =1+RC[-1] -> 960 | BJ25: =1+RC[-1] -> 961 | BK25: =1+RC[-1] -> 962 | BL25: =1+RC[-1] -> 963 | BM25: =1+RC[-1] -> 964 | BN25: =1+RC[-1] -> 965 | BO25: =1+RC[-1] -> 966 | BP25: =1+RC[-1] -> 967 | BQ25: =1+RC[-1] -> 968 | BR25: =1+RC[-1] -> 969 | BS25: =1+RC[-1] -> 970 | BT25: =1+RC[-1] -> 971 | BU25: =1+RC[-1] -> 972 | BV25: =1+RC[-1] -> 973 | BW25: =1+RC[-1] -> 974 | BX25: =1+RC[-1] -> 975 | BY25: =1+RC[-1] -> 976 | BZ25: =1+RC[-1] -> 977 | CA25: =1+RC[-1] -> 978 | CB25: =1+RC[-1] -> 979 | CC25: =1+RC[-1] -> 980 | CD25: =1+RC[-1] -> 981 | CE25: =1+RC[-1] -> 982 | CF25: =1+RC[-1] -> 983 | CG25: =1+RC[-1] -> 984 | CH25: =1+RC[-1] -> 985 | CI25: =1+RC[-1] -> 986 | CJ25: =1+RC[-1] -> 987 | CK25: =1+RC[-1] -> 988 | CL25: =1+RC[-1] -> 989 | CM25: =1+RC[-1] -> 990 | CN25: =1+RC[-1] -> 991 | CO25: =1+RC[-1] -> 992 | CP25: =1+RC[-1] -> 993 | CQ25: =1+RC[-1] -> 994 | CR25: =1+RC[-1] -> 995 | CS25: =1+RC[-1] -> 996 | CT25: =1+RC[-1] -> 997 | CU25: =1+RC[-1] -> 998 | CV25: =1+RC[-1] -> 999 | CW25: =1+RC[-1] -> 1000
B26: =R[-1]C[99]+1 -> 1001 | C26: =1+RC[-1] -> 1002 | D26: =1+RC[-1] -> 1003 | E26: =1+RC[-1] -> 1004 | F26: =1+RC[-1] -> 1005 | G26: =1+RC[-1] -> 1006 | H26: =1+RC[-1] -> 1007 | I26: =1+RC[-1] -> 1008 | J26: =1+RC[-1] -> 1009 | K26: =1+RC[-1] -> 1010 | L26: =1+RC[-1] -> 1011 | M26: =1+RC[-1] -> 1012 | N26: =1+RC[-1] -> 1013 | O26: =1+RC[-1] -> 1014 | P26: =1+RC[-1] -> 1015 | Q26: =1+RC[-1] -> 1016 | R26: =1+RC[-1] -> 1017 | S26: =1+RC[-1] -> 1018 | T26: =1+RC[-1] -> 1019 | U26: =1+RC[-1] -> 1020 | V26: =1+RC[-1] -> 1021 | W26: =1+RC[-1] -> 1022 | X26: =1+RC[-1] -> 1023 | Y26: =1+RC[-1] -> 1024 | Z26: =1+RC[-1] -> 1025 | AA26: =1+RC[-1] -> 1026 | AB26: =1+RC[-1] -> 1027 | AC26: =1+RC[-1] -> 1028 | AD26: =1+RC[-1] -> 1029 | AE26: =1+RC[-1] -> 1030 | AF26: =1+RC[-1] -> 1031 | AG26: =1+RC[-1] -> 1032 | AH26: =1+RC[-1] -> 1033 | AI26: =1+RC[-1] -> 1034 | AJ26: =1+RC[-1] -> 1035 | AK26: =1+RC[-1] -> 1036 | AL26: =1+RC[-1] -> 1037 | AM26: =1+RC[-1] -> 1038 | AN26: =1+RC[-1] -> 1039 | AO26: =1+RC[-1] -> 1040 | AP26: =1+RC[-1] -> 1041 | AQ26: =1+RC[-1] -> 1042 | AR26: =1+RC[-1] -> 1043 | AS26: =1+RC[-1] -> 1044 | AT26: =1+RC[-1] -> 1045 | AU26: =1+RC[-1] -> 1046 | AV26: =1+RC[-1] -> 1047 | AW26: =1+RC[-1] -> 1048 | AX26: =1+RC[-1] -> 1049 | AY26: =1+RC[-1] -> 1050 | AZ26: =1+RC[-1] -> 1051 | BA26: =1+RC[-1] -> 1052 | BB26: =1+RC[-1] -> 1053 | BC26: =1+RC[-1] -> 1054 | BD26: =1+RC[-1] -> 1055 | BE26: =1+RC[-1] -> 1056 | BF26: =1+RC[-1] -> 1057 | BG26: =1+RC[-1] -> 1058 | BH26: =1+RC[-1] -> 1059 | BI26: =1+RC[-1] -> 1060 | BJ26: =1+RC[-1] -> 1061 | BK26: =1+RC[-1] -> 1062 | BL26: =1+RC[-1] -> 1063 | BM26: =1+RC[-1] -> 1064 | BN26: =1+RC[-1] -> 1065 | BO26: =1+RC[-1] -> 1066 | BP26: =1+RC[-1] -> 1067 | BQ26: =1+RC[-1] -> 1068 | BR26: =1+RC[-1] -> 1069 | BS26: =1+RC[-1] -> 1070 | BT26: =1+RC[-1] -> 1071 | BU26: =1+RC[-1] -> 1072 | BV26: =1+RC[-1] -> 1073 | BW26: =1+RC[-1] -> 1074 | BX26: =1+RC[-1] -> 1075 | BY26: =1+RC[-1] -> 1076 | BZ26: =1+RC[-1] -> 1077 | CA26: =1+RC[-1] -> 1078 | CB26: =1+RC[-1] -> 1079 | CC26: =1+RC[-1] -> 1080 | CD26: =1+RC[-1] -> 1081 | CE26: =1+RC[-1] -> 1082 | CF26: =1+RC[-1] -> 1083 | CG26: =1+RC[-1] -> 1084 | CH26: =1+RC[-1] -> 1085 | CI26: =1+RC[-1] -> 1086 | CJ26: =1+RC[-1] -> 1087 | CK26: =1+RC[-1] -> 1088 | CL26: =1+RC[-1] -> 1089 | CM26: =1+RC[-1] -> 1090 | CN26: =1+RC[-1] -> 1091 | CO26: =1+RC[-1] -> 1092 | CP26: =1+RC[-1] -> 1093 | CQ26: =1+RC[-1] -> 1094 | CR26: =1+RC[-1] -> 1095 | CS26: =1+RC[-1] -> 1096 | CT26: =1+RC[-1] -> 1097 | CU26: =1+RC[-1] -> 1098 | CV26: =1+RC[-1] -> 1099 | CW26: =1+RC[-1] -> 1100
B27: =R[-1]C[99]+1 -> 1101 | C27: =1+RC[-1] -> 1102 | D27: =1+RC[-1] -> 1103 | E27: =1+RC[-1] -> 1104 | F27: =1+RC[-1] -> 1105 | G27: =1+RC[-1] -> 1106 | H27: =1+RC[-1] -> 1107 | I27: =1+RC[-1] -> 1108 | J27: =1+RC[-1] -> 1109 | K27: =1+RC[-1] -> 1110 | L27: =1+RC[-1] -> 1111 | M27: =1+RC[-1] -> 1112 | N27: =1+RC[-1] -> 1113 | O27: =1+RC[-1] -> 1114 | P27: =1+RC[-1] -> 1115 | Q27: =1+RC[-1] -> 1116 | R27: =1+RC[-1] -> 1117 | S27: =1+RC[-1] -> 1118 | T27: =1+RC[-1] -> 1119 | U27: =1+RC[-1] -> 1120 | V27: =1+RC[-1] -> 1121 | W27: =1+RC[-1] -> 1122 | X27: =1+RC[-1] -> 1123 | Y27: =1+RC[-1] -> 1124 | Z27: =1+RC[-1] -> 1125 | AA27: =1+RC[-1] -> 1126 | AB27: =1+RC[-1] -> 1127 | AC27: =1+RC[-1] -> 1128 | AD27: =1+RC[-1] -> 1129 | AE27: =1+RC[-1] -> 1130 | AF27: =1+RC[-1] -> 1131 | AG27: =1+RC[-1] -> 1132 | AH27: =1+RC[-1] -> 1133 | AI27: =1+RC[-1] -> 1134 | AJ27: =1+RC[-1] -> 1135 | AK27: =1+RC[-1] -> 1136 | AL27: =1+RC[-1] -> 1137 | AM27: =1+RC[-1] -> 1138 | AN27: =1+RC[-1] -> 1139 | AO27: =1+RC[-1] -> 1140 | AP27: =1+RC[-1] -> 1141 | AQ27: =1+RC[-1] -> 1142 | AR27: =1+RC[-1] -> 1143 | AS27: =1+RC[-1] -> 1144 | AT27: =1+RC[-1] -> 1145 | AU27: =1+RC[-1] -> 1146 | AV27: =1+RC[-1] -> 1147 | AW27: =1+RC[-1] -> 1148 | AX27: =1+RC[-1] -> 1149 | AY27: =1+RC[-1] -> 1150 | AZ27: =1+RC[-1] -> 1151 | BA27: =1+RC[-1] -> 1152 | BB27: =1+RC[-1] -> 1153 | BC27: =1+RC[-1] -> 1154 | BD27: =1+RC[-1] -> 1155 | BE27: =1+RC[-1] -> 1156 | BF27: =1+RC[-1] -> 1157 | BG27: =1+RC[-1] -> 1158 | BH27: =1+RC[-1] -> 1159 | BI27: =1+RC[-1] -> 1160 | BJ27: =1+RC[-1] -> 1161 | BK27: =1+RC[-1] -> 1162 | BL27: =1+RC[-1] -> 1163 | BM27: =1+RC[-1] -> 1164 | BN27: =1+RC[-1] -> 1165 | BO27: =1+RC[-1] -> 1166 | BP27: =1+RC[-1] -> 1167 | BQ27: =1+RC[-1] -> 1168 | BR27: =1+RC[-1] -> 1169 | BS27: =1+RC[-1] -> 1170 | BT27: =1+RC[-1] -> 1171 | BU27: =1+RC[-1] -> 1172 | BV27: =1+RC[-1] -> 1173 | BW27: =1+RC[-1] -> 1174 | BX27: =1+RC[-1] -> 1175 | BY27: =1+RC[-1] -> 1176 | BZ27: =1+RC[-1] -> 1177 | CA27: =1+RC[-1] -> 1178 | CB27: =1+RC[-1] -> 1179 | CC27: =1+RC[-1] -> 1180 | CD27: =1+RC[-1] -> 1181 | CE27: =1+RC[-1] -> 1182 | CF27: =1+RC[-1] -> 1183 | CG27: =1+RC[-1] -> 1184 | CH27: =1+RC[-1] -> 1185 | CI27: =1+RC[-1] -> 1186 | CJ27: =1+RC[-1] -> 1187 | CK27: =1+RC[-1] -> 1188 | CL27: =1+RC[-1] -> 1189 | CM27: =1+RC[-1] -> 1190 | CN27: =1+RC[-1] -> 1191 | CO27: =1+RC[-1] -> 1192 | CP27: =1+RC[-1] -> 1193 | CQ27: =1+RC[-1] -> 1194 | CR27: =1+RC[-1] -> 1195 | CS27: =1+RC[-1] -> 1196 | CT27: =1+RC[-1] -> 1197 | CU27: =1+RC[-1] -> 1198 | CV27: =1+RC[-1] -> 1199 | CW27: =1+RC[-1] -> 1200
B28: =R[-1]C[99]+1 -> 1201 | C28: =1+RC[-1] -> 1202 | D28: =1+RC[-1] -> 1203 | E28: =1+RC[-1] -> 1204 | F28: =1+RC[-1] -> 1205 | G28: =1+RC[-1] -> 1206 | H28: =1+RC[-1] -> 1207 | I28: =1+RC[-1] -> 1208 | J28: =1+RC[-1] -> 1209 | K28: =1+RC[-1] -> 1210 | L28: =1+RC[-1] -> 1211 | M28: =1+RC[-1] -> 1212 | N28: =1+RC[-1] -> 1213 | O28: =1+RC[-1] -> 1214 | P28: =1+RC[-1] -> 1215 | Q28: =1+RC[-1] -> 1216 | R28: =1+RC[-1] -> 1217 | S28: =1+RC[-1] -> 1218 | T28: =1+RC[-1] -> 1219 | U28: =1+RC[-1] -> 1220 | V28: =1+RC[-1] -> 1221 | W28: =1+RC[-1] -> 1222 | X28: =1+RC[-1] -> 1223 | Y28: =1+RC[-1] -> 1224 | Z28: =1+RC[-1] -> 1225 | AA28: =1+RC[-1] -> 1226 | AB28: =1+RC[-1] -> 1227 | AC28: =1+RC[-1] -> 1228 | AD28: =1+RC[-1] -> 1229 | AE28: =1+RC[-1] -> 1230 | AF28: =1+RC[-1] -> 1231 | AG28: =1+RC[-1] -> 1232 | AH28: =1+RC[-1] -> 1233 | AI28: =1+RC[-1] -> 1234 | AJ28: =1+RC[-1] -> 1235 | AK28: =1+RC[-1] -> 1236 | AL28: =1+RC[-1] -> 1237 | AM28: =1+RC[-1] -> 1238 | AN28: =1+RC[-1] -> 1239 | AO28: =1+RC[-1] -> 1240 | AP28: =1+RC[-1] -> 1241 | AQ28: =1+RC[-1] -> 1242 | AR28: =1+RC[-1] -> 1243 | AS28: =1+RC[-1] -> 1244 | AT28: =1+RC[-1] -> 1245 | AU28: =1+RC[-1] -> 1246 | AV28: =1+RC[-1] -> 1247 | AW28: =1+RC[-1] -> 1248 | AX28: =1+RC[-1] -> 1249 | AY28: =1+RC[-1] -> 1250 | AZ28: =1+RC[-1] -> 1251 | BA28: =1+RC[-1] -> 1252 | BB28: =1+RC[-1] -> 1253 | BC28: =1+RC[-1] -> 1254 | BD28: =1+RC[-1] -> 1255 | BE28: =1+RC[-1] -> 1256 | BF28: =1+RC[-1] -> 1257 | BG28: =1+RC[-1] -> 1258 | BH28: =1+RC[-1] -> 1259 | BI28: =1+RC[-1] -> 1260 | BJ28: =1+RC[-1] -> 1261 | BK28: =1+RC[-1] -> 1262 | BL28: =1+RC[-1] -> 1263 | BM28: =1+RC[-1] -> 1264 | BN28: =1+RC[-1] -> 1265 | BO28: =1+RC[-1] -> 1266 | BP28: =1+RC[-1] -> 1267 | BQ28: =1+RC[-1] -> 1268 | BR28: =1+RC[-1] -> 1269 | BS28: =1+RC[-1] -> 1270 | BT28: =1+RC[-1] -> 1271 | BU28: =1+RC[-1] -> 1272 | BV28: =1+RC[-1] -> 1273 | BW28: =1+RC[-1] -> 1274 | BX28: =1+RC[-1] -> 1275 | BY28: =1+RC[-1] -> 1276 | BZ28: =1+RC[-1] -> 1277 | CA28: =1+RC[-1] -> 1278 | CB28: =1+RC[-1] -> 1279 | CC28: =1+RC[-1] -> 1280 | CD28: =1+RC[-1] -> 1281 | CE28: =1+RC[-1] -> 1282 | CF28: =1+RC[-1] -> 1283 | CG28: =1+RC[-1] -> 1284 | CH28: =1+RC[-1] -> 1285 | CI28: =1+RC[-1] -> 1286 | CJ28: =1+RC[-1] -> 1287 | CK28: =1+RC[-1] -> 1288 | CL28: =1+RC[-1] -> 1289 | CM28: =1+RC[-1] -> 1290 | CN28: =1+RC[-1] -> 1291 | CO28: =1+RC[-1] -> 1292 | CP28: =1+RC[-1] -> 1293 | CQ28: =1+RC[-1] -> 1294 | CR28: =1+RC[-1] -> 1295 | CS28: =1+RC[-1] -> 1296 | CT28: =1+RC[-1] -> 1297 | CU28: =1+RC[-1] -> 1298 | CV28: =1+RC[-1] -> 1299 | CW28: =1+RC[-1] -> 1300
B29: =R[-1]C[99]+1 -> 1301 | C29: =1+RC[-1] -> 1302 | D29: =1+RC[-1] -> 1303 | E29: =1+RC[-1] -> 1304 | F29: =1+RC[-1] -> 1305 | G29: =1+RC[-1] -> 1306 | H29: =1+RC[-1] -> 1307 | I29: =1+RC[-1] -> 1308 | J29: =1+RC[-1] -> 1309 | K29: =1+RC[-1] -> 1310 | L29: =1+RC[-1] -> 1311 | M29: =1+RC[-1] -> 1312 | N29: =1+RC[-1] -> 1313 | O29: =1+RC[-1] -> 1314 | P29: =1+RC[-1] -> 1315 | Q29: =1+RC[-1] -> 1316 | R29: =1+RC[-1] -> 1317 | S29: =1+RC[-1] -> 1318 | T29: =1+RC[-1] -> 1319 | U29: =1+RC[-1] -> 1320 | V29: =1+RC[-1] -> 1321 | W29: =1+RC[-1] -> 1322 | X29: =1+RC[-1] -> 1323 | Y29: =1+RC[-1] -> 1324 | Z29: =1+RC[-1] -> 1325 | AA29: =1+RC[-1] -> 1326 | AB29: =1+RC[-1] -> 1327 | AC29: =1+RC[-1] -> 1328 | AD29: =1+RC[-1] -> 1329 | AE29: =1+RC[-1] -> 1330 | AF29: =1+RC[-1] -> 1331 | AG29: =1+RC[-1] -> 1332 | AH29: =1+RC[-1] -> 1333 | AI29: =1+RC[-1] -> 1334 | AJ29: =1+RC[-1] -> 1335 | AK29: =1+RC[-1] -> 1336 | AL29: =1+RC[-1] -> 1337 | AM29: =1+RC[-1] -> 1338 | AN29: =1+RC[-1] -> 1339 | AO29: =1+RC[-1] -> 1340 | AP29: =1+RC[-1] -> 1341 | AQ29: =1+RC[-1] -> 1342 | AR29: =1+RC[-1] -> 1343 | AS29: =1+RC[-1] -> 1344 | AT29: =1+RC[-1] -> 1345 | AU29: =1+RC[-1] -> 1346 | AV29: =1+RC[-1] -> 1347 | AW29: =1+RC[-1] -> 1348 | AX29: =1+RC[-1] -> 1349 | AY29: =1+RC[-1] -> 1350 | AZ29: =1+RC[-1] -> 1351 | BA29: =1+RC[-1] -> 1352 | BB29: =1+RC[-1] -> 1353 | BC29: =1+RC[-1] -> 1354 | BD29: =1+RC[-1] -> 1355 | BE29: =1+RC[-1] -> 1356 | BF29: =1+RC[-1] -> 1357 | BG29: =1+RC[-1] -> 1358 | BH29: =1+RC[-1] -> 1359 | BI29: =1+RC[-1] -> 1360 | BJ29: =1+RC[-1] -> 1361 | BK29: =1+RC[-1] -> 1362 | BL29: =1+RC[-1] -> 1363 | BM29: =1+RC[-1] -> 1364 | BN29: =1+RC[-1] -> 1365 | BO29: =1+RC[-1] -> 1366 | BP29: =1+RC[-1] -> 1367 | BQ29: =1+RC[-1] -> 1368 | BR29: =1+RC[-1] -> 1369 | BS29: =1+RC[-1] -> 1370 | BT29: =1+RC[-1] -> 1371 | BU29: =1+RC[-1] -> 1372 | BV29: =1+RC[-1] -> 1373 | BW29: =1+RC[-1] -> 1374 | BX29: =1+RC[-1] -> 1375 | BY29: =1+RC[-1] -> 1376 | BZ29: =1+RC[-1] -> 1377 | CA29: =1+RC[-1] -> 1378 | CB29: =1+RC[-1] -> 1379 | CC29: =1+RC[-1] -> 1380 | CD29: =1+RC[-1] -> 1381 | CE29: =1+RC[-1] -> 1382 | CF29: =1+RC[-1] -> 1383 | CG29: =1+RC[-1] -> 1384 | CH29: =1+RC[-1] -> 1385 | CI29: =1+RC[-1] -> 1386 | CJ29: =1+RC[-1] -> 1387 | CK29: =1+RC[-1] -> 1388 | CL29: =1+RC[-1] -> 1389 | CM29: =1+RC[-1] -> 1390 | CN29: =1+RC[-1] -> 1391 | CO29: =1+RC[-1] -> 1392 | CP29: =1+RC[-1] -> 1393 | CQ29: =1+RC[-1] -> 1394 | CR29: =1+RC[-1] -> 1395 | CS29: =1+RC[-1] -> 1396 | CT29: =1+RC[-1] -> 1397 | CU29: =1+RC[-1] -> 1398 | CV29: =1+RC[-1] -> 1399 | CW29: =1+RC[-1] -> 1400
B30: =R[-1]C[99]+1 -> 1401 | C30: =1+RC[-1] -> 1402 | D30: =1+RC[-1] -> 1403 | E30: =1+RC[-1] -> 1404 | F30: =1+RC[-1] -> 1405 | G30: =1+RC[-1] -> 1406 | H30: =1+RC[-1] -> 1407 | I30: =1+RC[-1] -> 1408 | J30: =1+RC[-1] -> 1409 | K30: =1+RC[-1] -> 1410 | L30: =1+RC[-1] -> 1411 | M30: =1+RC[-1] -> 1412 | N30: =1+RC[-1] -> 1413 | O30: =1+RC[-1] -> 1414 | P30: =1+RC[-1] -> 1415 | Q30: =1+RC[-1] -> 1416 | R30: =1+RC[-1] -> 1417 | S30: =1+RC[-1] -> 1418 | T30: =1+RC[-1] -> 1419 | U30: =1+RC[-1] -> 1420 | V30: =1+RC[-1] -> 1421 | W30: =1+RC[-1] -> 1422 | X30: =1+RC[-1] -> 1423 | Y30: =1+RC[-1] -> 1424 | Z30: =1+RC[-1] -> 1425 | AA30: =1+RC[-1] -> 1426 | AB30: =1+RC[-1] -> 1427 | AC30: =1+RC[-1] -> 1428 | AD30: =1+RC[-1] -> 1429 | AE30: =1+RC[-1] -> 1430 | AF30: =1+RC[-1] -> 1431 | AG30: =1+RC[-1] -> 1432 | AH30: =1+RC[-1] -> 1433 | AI30: =1+RC[-1] -> 1434 | AJ30: =1+RC[-1] -> 1435 | AK30: =1+RC[-1] -> 1436 | AL30: =1+RC[-1] -> 1437 | AM30: =1+RC[-1] -> 1438 | AN30: =1+RC[-1] -> 1439 | AO30: =1+RC[-1] -> 1440 | AP30: =1+RC[-1] -> 1441 | AQ30: =1+RC[-1] -> 1442 | AR30: =1+RC[-1] -> 1443 | AS30: =1+RC[-1] -> 1444 | AT30: =1+RC[-1] -> 1445 | AU30: =1+RC[-1] -> 1446 | AV30: =1+RC[-1] -> 1447 | AW30: =1+RC[-1] -> 1448 | AX30: =1+RC[-1] -> 1449 | AY30: =1+RC[-1] -> 1450 | AZ30: =1+RC[-1] -> 1451 | BA30: =1+RC[-1] -> 1452 | BB30: =1+RC[-1] -> 1453 | BC30: =1+RC[-1] -> 1454 | BD30: =1+RC[-1] -> 1455 | BE30: =1+RC[-1] -> 1456 | BF30: =1+RC[-1] -> 1457 | BG30: =1+RC[-1] -> 1458 | BH30: =1+RC[-1] -> 1459 | BI30: =1+RC[-1] -> 1460 | BJ30: =1+RC[-1] -> 1461 | BK30: =1+RC[-1] -> 1462 | BL30: =1+RC[-1] -> 1463 | BM30: =1+RC[-1] -> 1464 | BN30: =1+RC[-1] -> 1465 | BO30: =1+RC[-1] -> 1466 | BP30: =1+RC[-1] -> 1467 | BQ30: =1+RC[-1] -> 1468 | BR30: =1+RC[-1] -> 1469 | BS30: =1+RC[-1] -> 1470 | BT30: =1+RC[-1] -> 1471 | BU30: =1+RC[-1] -> 1472 | BV30: =1+RC[-1] -> 1473 | BW30: =1+RC[-1] -> 1474 | BX30: =1+RC[-1] -> 1475 | BY30: =1+RC[-1] -> 1476 | BZ30: =1+RC[-1] -> 1477 | CA30: =1+RC[-1] -> 1478 | CB30: =1+RC[-1] -> 1479 | CC30: =1+RC[-1] -> 1480 | CD30: =1+RC[-1] -> 1481 | CE30: =1+RC[-1] -> 1482 | CF30: =1+RC[-1] -> 1483 | CG30: =1+RC[-1] -> 1484 | CH30: =1+RC[-1] -> 1485 | CI30: =1+RC[-1] -> 1486 | CJ30: =1+RC[-1] -> 1487 | CK30: =1+RC[-1] -> 1488 | CL30: =1+RC[-1] -> 1489 | CM30: =1+RC[-1] -> 1490 | CN30: =1+RC[-1] -> 1491 | CO30: =1+RC[-1] -> 1492 | CP30: =1+RC[-1] -> 1493 | CQ30: =1+RC[-1] -> 1494 | CR30: =1+RC[-1] -> 1495 | CS30: =1+RC[-1] -> 1496 | CT30: =1+RC[-1] -> 1497 | CU30: =1+RC[-1] -> 1498 | CV30: =1+RC[-1] -> 1499 | CW30: =1+RC[-1] -> 1500
B31: =R[-1]C[99]+1 -> 1501 | C31: =1+RC[-1] -> 1502 | D31: =1+RC[-1] -> 1503 | E31: =1+RC[-1] -> 1504 | F31: =1+RC[-1] -> 1505 | G31: =1+RC[-1] -> 1506 | H31: =1+RC[-1] -> 1507 | I31: =1+RC[-1] -> 1508 | J31: =1+RC[-1] -> 1509 | K31: =1+RC[-1] -> 1510 | L31: =1+RC[-1] -> 1511 | M31: =1+RC[-1] -> 1512 | N31: =1+RC[-1] -> 1513 | O31: =1+RC[-1] -> 1514 | P31: =1+RC[-1] -> 1515 | Q31: =1+RC[-1] -> 1516 | R31: =1+RC[-1] -> 1517 | S31: =1+RC[-1] -> 1518 | T31: =1+RC[-1] -> 1519 | U31: =1+RC[-1] -> 1520 | V31: =1+RC[-1] -> 1521 | W31: =1+RC[-1] -> 1522 | X31: =1+RC[-1] -> 1523 | Y31: =1+RC[-1] -> 1524 | Z31: =1+RC[-1] -> 1525 | AA31: =1+RC[-1] -> 1526 | AB31: =1+RC[-1] -> 1527 | AC31: =1+RC[-1] -> 1528 | AD31: =1+RC[-1] -> 1529 | AE31: =1+RC[-1] -> 1530 | AF31: =1+RC[-1] -> 1531 | AG31: =1+RC[-1] -> 1532 | AH31: =1+RC[-1] -> 1533 | AI31: =1+RC[-1] -> 1534 | AJ31: =1+RC[-1] -> 1535 | AK31: =1+RC[-1] -> 1536 | AL31: =1+RC[-1] -> 1537 | AM31: =1+RC[-1] -> 1538 | AN31: =1+RC[-1] -> 1539 | AO31: =1+RC[-1] -> 1540 | AP31: =1+RC[-1] -> 1541 | AQ31: =1+RC[-1] -> 1542 | AR31: =1+RC[-1] -> 1543 | AS31: =1+RC[-1] -> 1544 | AT31: =1+RC[-1] -> 1545 | AU31: =1+RC[-1] -> 1546 | AV31: =1+RC[-1] -> 1547 | AW31: =1+RC[-1] -> 1548 | AX31: =1+RC[-1] -> 1549 | AY31: =1+RC[-1] -> 1550 | AZ31: =1+RC[-1] -> 1551 | BA31: =1+RC[-1] -> 1552 | BB31: =1+RC[-1] -> 1553 | BC31: =1+RC[-1] -> 1554 | BD31: =1+RC[-1] -> 1555 | BE31: =1+RC[-1] -> 1556 | BF31: =1+RC[-1] -> 1557 | BG31: =1+RC[-1] -> 1558 | BH31: =1+RC[-1] -> 1559 | BI31: =1+RC[-1] -> 1560 | BJ31: =1+RC[-1] -> 1561 | BK31: =1+RC[-1] -> 1562 | BL31: =1+RC[-1] -> 1563 | BM31: =1+RC[-1] -> 1564 | BN31: =1+RC[-1] -> 1565 | BO31: =1+RC[-1] -> 1566 | BP31: =1+RC[-1] -> 1567 | BQ31: =1+RC[-1] -> 1568 | BR31: =1+RC[-1] -> 1569 | BS31: =1+RC[-1] -> 1570 | BT31: =1+RC[-1] -> 1571 | BU31: =1+RC[-1] -> 1572 | BV31: =1+RC[-1] -> 1573 | BW31: =1+RC[-1] -> 1574 | BX31: =1+RC[-1] -> 1575 | BY31: =1+RC[-1] -> 1576 | BZ31: =1+RC[-1] -> 1577 | CA31: =1+RC[-1] -> 1578 | CB31: =1+RC[-1] -> 1579 | CC31: =1+RC[-1] -> 1580 | CD31: =1+RC[-1] -> 1581 | CE31: =1+RC[-1] -> 1582 | CF31: =1+RC[-1] -> 1583 | CG31: =1+RC[-1] -> 1584 | CH31: =1+RC[-1] -> 1585 | CI31: =1+RC[-1] -> 1586 | CJ31: =1+RC[-1] -> 1587 | CK31: =1+RC[-1] -> 1588 | CL31: =1+RC[-1] -> 1589 | CM31: =1+RC[-1] -> 1590 | CN31: =1+RC[-1] -> 1591 | CO31: =1+RC[-1] -> 1592 | CP31: =1+RC[-1] -> 1593 | CQ31: =1+RC[-1] -> 1594 | CR31: =1+RC[-1] -> 1595 | CS31: =1+RC[-1] -> 1596 | CT31: =1+RC[-1] -> 1597 | CU31: =1+RC[-1] -> 1598 | CV31: =1+RC[-1] -> 1599 | CW31: =1+RC[-1] -> 1600
B32: =R[-1]C[99]+1 -> 1601 | C32: =1+RC[-1] -> 1602 | D32: =1+RC[-1] -> 1603 | E32: =1+RC[-1] -> 1604 | F32: =1+RC[-1] -> 1605 | G32: =1+RC[-1] -> 1606 | H32: =1+RC[-1] -> 1607 | I32: =1+RC[-1] -> 1608 | J32: =1+RC[-1] -> 1609 | K32: =1+RC[-1] -> 1610 | L32: =1+RC[-1] -> 1611 | M32: =1+RC[-1] -> 1612 | N32: =1+RC[-1] -> 1613 | O32: =1+RC[-1] -> 1614 | P32: =1+RC[-1] -> 1615 | Q32: =1+RC[-1] -> 1616 | R32: =1+RC[-1] -> 1617 | S32: =1+RC[-1] -> 1618 | T32: =1+RC[-1] -> 1619 | U32: =1+RC[-1] -> 1620 | V32: =1+RC[-1] -> 1621 | W32: =1+RC[-1] -> 1622 | X32: =1+RC[-1] -> 1623 | Y32: =1+RC[-1] -> 1624 | Z32: =1+RC[-1] -> 1625 | AA32: =1+RC[-1] -> 1626 | AB32: =1+RC[-1] -> 1627 | AC32: =1+RC[-1] -> 1628 | AD32: =1+RC[-1] -> 1629 | AE32: =1+RC[-1] -> 1630 | AF32: =1+RC[-1] -> 1631 | AG32: =1+RC[-1] -> 1632 | AH32: =1+RC[-1] -> 1633 | AI32: =1+RC[-1] -> 1634 | AJ32: =1+RC[-1] -> 1635 | AK32: =1+RC[-1] -> 1636 | AL32: =1+RC[-1] -> 1637 | AM32: =1+RC[-1] -> 1638 | AN32: =1+RC[-1] -> 1639 | AO32: =1+RC[-1] -> 1640 | AP32: =1+RC[-1] -> 1641 | AQ32: =1+RC[-1] -> 1642 | AR32: =1+RC[-1] -> 1643 | AS32: =1+RC[-1] -> 1644 | AT32: =1+RC[-1] -> 1645 | AU32: =1+RC[-1] -> 1646 | AV32: =1+RC[-1] -> 1647 | AW32: =1+RC[-1] -> 1648 | AX32: =1+RC[-1] -> 1649 | AY32: =1+RC[-1] -> 1650 | AZ32: =1+RC[-1] -> 1651 | BA32: =1+RC[-1] -> 1652 | BB32: =1+RC[-1] -> 1653 | BC32: =1+RC[-1] -> 1654 | BD32: =1+RC[-1] -> 1655 | BE32: =1+RC[-1] -> 1656 | BF32: =1+RC[-1] -> 1657 | BG32: =1+RC[-1] -> 1658 | BH32: =1+RC[-1] -> 1659 | BI32: =1+RC[-1] -> 1660 | BJ32: =1+RC[-1] -> 1661 | BK32: =1+RC[-1] -> 1662 | BL32: =1+RC[-1] -> 1663 | BM32: =1+RC[-1] -> 1664 | BN32: =1+RC[-1] -> 1665 | BO32: =1+RC[-1] -> 1666 | BP32: =1+RC[-1] -> 1667 | BQ32: =1+RC[-1] -> 1668 | BR32: =1+RC[-1] -> 1669 | BS32: =1+RC[-1] -> 1670 | BT32: =1+RC[-1] -> 1671 | BU32: =1+RC[-1] -> 1672 | BV32: =1+RC[-1] -> 1673 | BW32: =1+RC[-1] -> 1674 | BX32: =1+RC[-1] -> 1675 | BY32: =1+RC[-1] -> 1676 | BZ32: =1+RC[-1] -> 1677 | CA32: =1+RC[-1] -> 1678 | CB32: =1+RC[-1] -> 1679 | CC32: =1+RC[-1] -> 1680 | CD32: =1+RC[-1] -> 1681 | CE32: =1+RC[-1] -> 1682 | CF32: =1+RC[-1] -> 1683 | CG32: =1+RC[-1] -> 1684 | CH32: =1+RC[-1] -> 1685 | CI32: =1+RC[-1] -> 1686 | CJ32: =1+RC[-1] -> 1687 | CK32: =1+RC[-1] -> 1688 | CL32: =1+RC[-1] -> 1689 | CM32: =1+RC[-1] -> 1690 | CN32: =1+RC[-1] -> 1691 | CO32: =1+RC[-1] -> 1692 | CP32: =1+RC[-1] -> 1693 | CQ32: =1+RC[-1] -> 1694 | CR32: =1+RC[-1] -> 1695 | CS32: =1+RC[-1] -> 1696 | CT32: =1+RC[-1] -> 1697 | CU32: =1+RC[-1] -> 1698 | CV32: =1+RC[-1] -> 1699 | CW32: =1+RC[-1] -> 1700
B33: =R[-1]C[99]+1 -> 1701 | C33: =1+RC[-1] -> 1702 | D33: =1+RC[-1] -> 1703 | E33: =1+RC[-1] -> 1704 | F33: =1+RC[-1] -> 1705 | G33: =1+RC[-1] -> 1706 | H33: =1+RC[-1] -> 1707 | I33: =1+RC[-1] -> 1708 | J33: =1+RC[-1] -> 1709 | K33: =1+RC[-1] -> 1710 | L33: =1+RC[-1] -> 1711 | M33: =1+RC[-1] -> 1712 | N33: =1+RC[-1] -> 1713 | O33: =1+RC[-1] -> 1714 | P33: =1+RC[-1] -> 1715 | Q33: =1+RC[-1] -> 1716 | R33: =1+RC[-1] -> 1717 | S33: =1+RC[-1] -> 1718 | T33: =1+RC[-1] -> 1719 | U33: =1+RC[-1] -> 1720 | V33: =1+RC[-1] -> 1721 | W33: =1+RC[-1] -> 1722 | X33: =1+RC[-1] -> 1723 | Y33: =1+RC[-1] -> 1724 | Z33: =1+RC[-1] -> 1725 | AA33: =1+RC[-1] -> 1726 | AB33: =1+RC[-1] -> 1727 | AC33: =1+RC[-1] -> 1728 | AD33: =1+RC[-1] -> 1729 | AE33: =1+RC[-1] -> 1730 | AF33: =1+RC[-1] -> 1731 | AG33: =1+RC[-1] -> 1732 | AH33: =1+RC[-1] -> 1733 | AI33: =1+RC[-1] -> 1734 | AJ33: =1+RC[-1] -> 1735 | AK33: =1+RC[-1] -> 1736 | AL33: =1+RC[-1] -> 1737 | AM33: =1+RC[-1] -> 1738 | AN33: =1+RC[-1] -> 1739 | AO33: =1+RC[-1] -> 1740 | AP33: =1+RC[-1] -> 1741 | AQ33: =1+RC[-1] -> 1742 | AR33: =1+RC[-1] -> 1743 | AS33: =1+RC[-1] -> 1744 | AT33: =1+RC[-1] -> 1745 | AU33: =1+RC[-1] -> 1746 | AV33: =1+RC[-1] -> 1747 | AW33: =1+RC[-1] -> 1748 | AX33: =1+RC[-1] -> 1749 | AY33: =1+RC[-1] -> 1750 | AZ33: =1+RC[-1] -> 1751 | BA33: =1+RC[-1] -> 1752 | BB33: =1+RC[-1] -> 1753 | BC33: =1+RC[-1] -> 1754 | BD33: =1+RC[-1] -> 1755 | BE33: =1+RC[-1] -> 1756 | BF33: =1+RC[-1] -> 1757 | BG33: =1+RC[-1] -> 1758 | BH33: =1+RC[-1] -> 1759 | BI33: =1+RC[-1] -> 1760 | BJ33: =1+RC[-1] -> 1761 | BK33: =1+RC[-1] -> 1762 | BL33: =1+RC[-1] -> 1763 | BM33: =1+RC[-1] -> 1764 | BN33: =1+RC[-1] -> 1765 | BO33: =1+RC[-1] -> 1766 | BP33: =1+RC[-1] -> 1767 | BQ33: =1+RC[-1] -> 1768 | BR33: =1+RC[-1] -> 1769 | BS33: =1+RC[-1] -> 1770 | BT33: =1+RC[-1] -> 1771 | BU33: =1+RC[-1] -> 1772 | BV33: =1+RC[-1] -> 1773 | BW33: =1+RC[-1] -> 1774 | BX33: =1+RC[-1] -> 1775 | BY33: =1+RC[-1] -> 1776 | BZ33: =1+RC[-1] -> 1777 | CA33: =1+RC[-1] -> 1778 | CB33: =1+RC[-1] -> 1779 | CC33: =1+RC[-1] -> 1780 | CD33: =1+RC[-1] -> 1781 | CE33: =1+RC[-1] -> 1782 | CF33: =1+RC[-1] -> 1783 | CG33: =1+RC[-1] -> 1784 | CH33: =1+RC[-1] -> 1785 | CI33: =1+RC[-1] -> 1786 | CJ33: =1+RC[-1] -> 1787 | CK33: =1+RC[-1] -> 1788 | CL33: =1+RC[-1] -> 1789 | CM33: =1+RC[-1] -> 1790 | CN33: =1+RC[-1] -> 1791 | CO33: =1+RC[-1] -> 1792 | CP33: =1+RC[-1] -> 1793 | CQ33: =1+RC[-1] -> 1794 | CR33: =1+RC[-1] -> 1795 | CS33: =1+RC[-1] -> 1796 | CT33: =1+RC[-1] -> 1797 | CU33: =1+RC[-1] -> 1798 | CV33: =1+RC[-1] -> 1799 | CW33: =1+RC[-1] -> 1800
B34: =R[-1]C[99]+1 -> 1801 | C34: =1+RC[-1] -> 1802 | D34: =1+RC[-1] -> 1803 | E34: =1+RC[-1] -> 1804 | F34: =1+RC[-1] -> 1805 | G34: =1+RC[-1] -> 1806 | H34: =1+RC[-1] -> 1807 | I34: =1+RC[-1] -> 1808 | J34: =1+RC[-1] -> 1809 | K34: =1+RC[-1] -> 1810 | L34: =1+RC[-1] -> 1811 | M34: =1+RC[-1] -> 1812 | N34: =1+RC[-1] -> 1813 | O34: =1+RC[-1] -> 1814 | P34: =1+RC[-1] -> 1815 | Q34: =1+RC[-1] -> 1816 | R34: =1+RC[-1] -> 1817 | S34: =1+RC[-1] -> 1818 | T34: =1+RC[-1] -> 1819 | U34: =1+RC[-1] -> 1820 | V34: =1+RC[-1] -> 1821 | W34: =1+RC[-1] -> 1822 | X34: =1+RC[-1] -> 1823 | Y34: =1+RC[-1] -> 1824 | Z34: =1+RC[-1] -> 1825 | AA34: =1+RC[-1] -> 1826 | AB34: =1+RC[-1] -> 1827 | AC34: =1+RC[-1] -> 1828 | AD34: =1+RC[-1] -> 1829 | AE34: =1+RC[-1] -> 1830 | AF34: =1+RC[-1] -> 1831 | AG34: =1+RC[-1] -> 1832 | AH34: =1+RC[-1] -> 1833 | AI34: =1+RC[-1] -> 1834 | AJ34: =1+RC[-1] -> 1835 | AK34: =1+RC[-1] -> 1836 | AL34: =1+RC[-1] -> 1837 | AM34: =1+RC[-1] -> 1838 | AN34: =1+RC[-1] -> 1839 | AO34: =1+RC[-1] -> 1840 | AP34: =1+RC[-1] -> 1841 | AQ34: =1+RC[-1] -> 1842 | AR34: =1+RC[-1] -> 1843 | AS34: =1+RC[-1] -> 1844 | AT34: =1+RC[-1] -> 1845 | AU34: =1+RC[-1] -> 1846 | AV34: =1+RC[-1] -> 1847 | AW34: =1+RC[-1] -> 1848 | AX34: =1+RC[-1] -> 1849 | AY34: =1+RC[-1] -> 1850 | AZ34: =1+RC[-1] -> 1851 | BA34: =1+RC[-1] -> 1852 | BB34: =1+RC[-1] -> 1853 | BC34: =1+RC[-1] -> 1854 | BD34: =1+RC[-1] -> 1855 | BE34: =1+RC[-1] -> 1856 | BF34: =1+RC[-1] -> 1857 | BG34: =1+RC[-1] -> 1858 | BH34: =1+RC[-1] -> 1859 | BI34: =1+RC[-1] -> 1860 | BJ34: =1+RC[-1] -> 1861 | BK34: =1+RC[-1] -> 1862 | BL34: =1+RC[-1] -> 1863 | BM34: =1+RC[-1] -> 1864 | BN34: =1+RC[-1] -> 1865 | BO34: =1+RC[-1] -> 1866 | BP34: =1+RC[-1] -> 1867 | BQ34: =1+RC[-1] -> 1868 | BR34: =1+RC[-1] -> 1869 | BS34: =1+RC[-1] -> 1870 | BT34: =1+RC[-1] -> 1871 | BU34: =1+RC[-1] -> 1872 | BV34: =1+RC[-1] -> 1873 | BW34: =1+RC[-1] -> 1874 | BX34: =1+RC[-1] -> 1875 | BY34: =1+RC[-1] -> 1876 | BZ34: =1+RC[-1] -> 1877 | CA34: =1+RC[-1] -> 1878 | CB34: =1+RC[-1] -> 1879 | CC34: =1+RC[-1] -> 1880 | CD34: =1+RC[-1] -> 1881 | CE34: =1+RC[-1] -> 1882 | CF34: =1+RC[-1] -> 1883 | CG34: =1+RC[-1] -> 1884 | CH34: =1+RC[-1] -> 1885 | CI34: =1+RC[-1] -> 1886 | CJ34: =1+RC[-1] -> 1887 | CK34: =1+RC[-1] -> 1888 | CL34: =1+RC[-1] -> 1889 | CM34: =1+RC[-1] -> 1890 | CN34: =1+RC[-1] -> 1891 | CO34: =1+RC[-1] -> 1892 | CP34: =1+RC[-1] -> 1893 | CQ34: =1+RC[-1] -> 1894 | CR34: =1+RC[-1] -> 1895 | CS34: =1+RC[-1] -> 1896 | CT34: =1+RC[-1] -> 1897 | CU34: =1+RC[-1] -> 1898 | CV34: =1+RC[-1] -> 1899 | CW34: =1+RC[-1] -> 1900
B35: =R[-1]C[99]+1 -> 1901 | C35: =1+RC[-1] -> 1902 | D35: =1+RC[-1] -> 1903 | E35: =1+RC[-1] -> 1904 | F35: =1+RC[-1] -> 1905 | G35: =1+RC[-1] -> 1906 | H35: =1+RC[-1] -> 1907 | I35: =1+RC[-1] -> 1908 | J35: =1+RC[-1] -> 1909 | K35: =1+RC[-1] -> 1910 | L35: =1+RC[-1] -> 1911 | M35: =1+RC[-1] -> 1912 | N35: =1+RC[-1] -> 1913 | O35: =1+RC[-1] -> 1914 | P35: =1+RC[-1] -> 1915 | Q35: =1+RC[-1] -> 1916 | R35: =1+RC[-1] -> 1917 | S35: =1+RC[-1] -> 1918 | T35: =1+RC[-1] -> 1919 | U35: =1+RC[-1] -> 1920 | V35: =1+RC[-1] -> 1921 | W35: =1+RC[-1] -> 1922 | X35: =1+RC[-1] -> 1923 | Y35: =1+RC[-1] -> 1924 | Z35: =1+RC[-1] -> 1925 | AA35: =1+RC[-1] -> 1926 | AB35: =1+RC[-1] -> 1927 | AC35: =1+RC[-1] -> 1928 | AD35: =1+RC[-1] -> 1929 | AE35: =1+RC[-1] -> 1930 | AF35: =1+RC[-1] -> 1931 | AG35: =1+RC[-1] -> 1932 | AH35: =1+RC[-1] -> 1933 | AI35: =1+RC[-1] -> 1934 | AJ35: =1+RC[-1] -> 1935 | AK35: =1+RC[-1] -> 1936 | AL35: =1+RC[-1] -> 1937 | AM35: =1+RC[-1] -> 1938 | AN35: =1+RC[-1] -> 1939 | AO35: =1+RC[-1] -> 1940 | AP35: =1+RC[-1] -> 1941 | AQ35: =1+RC[-1] -> 1942 | AR35: =1+RC[-1] -> 1943 | AS35: =1+RC[-1] -> 1944 | AT35: =1+RC[-1] -> 1945 | AU35: =1+RC[-1] -> 1946 | AV35: =1+RC[-1] -> 1947 | AW35: =1+RC[-1] -> 1948 | AX35: =1+RC[-1] -> 1949 | AY35: =1+RC[-1] -> 1950 | AZ35: =1+RC[-1] -> 1951 | BA35: =1+RC[-1] -> 1952 | BB35: =1+RC[-1] -> 1953 | BC35: =1+RC[-1] -> 1954 | BD35: =1+RC[-1] -> 1955 | BE35: =1+RC[-1] -> 1956 | BF35: =1+RC[-1] -> 1957 | BG35: =1+RC[-1] -> 1958 | BH35: =1+RC[-1] -> 1959 | BI35: =1+RC[-1] -> 1960 | BJ35: =1+RC[-1] -> 1961 | BK35: =1+RC[-1] -> 1962 | BL35: =1+RC[-1] -> 1963 | BM35: =1+RC[-1] -> 1964 | BN35: =1+RC[-1] -> 1965 | BO35: =1+RC[-1] -> 1966 | BP35: =1+RC[-1] -> 1967 | BQ35: =1+RC[-1] -> 1968 | BR35: =1+RC[-1] -> 1969 | BS35: =1+RC[-1] -> 1970 | BT35: =1+RC[-1] -> 1971 | BU35: =1+RC[-1] -> 1972 | BV35: =1+RC[-1] -> 1973 | BW35: =1+RC[-1] -> 1974 | BX35: =1+RC[-1] -> 1975 | BY35: =1+RC[-1] -> 1976 | BZ35: =1+RC[-1] -> 1977 | CA35: =1+RC[-1] -> 1978 | CB35: =1+RC[-1] -> 1979 | CC35: =1+RC[-1] -> 1980 | CD35: =1+RC[-1] -> 1981 | CE35: =1+RC[-1] -> 1982 | CF35: =1+RC[-1] -> 1983 | CG35: =1+RC[-1] -> 1984 | CH35: =1+RC[-1] -> 1985 | CI35: =1+RC[-1] -> 1986 | CJ35: =1+RC[-1] -> 1987 | CK35: =1+RC[-1] -> 1988 | CL35: =1+RC[-1] -> 1989 | CM35: =1+RC[-1] -> 1990 | CN35: =1+RC[-1] -> 1991 | CO35: =1+RC[-1] -> 1992 | CP35: =1+RC[-1] -> 1993 | CQ35: =1+RC[-1] -> 1994 | CR35: =1+RC[-1] -> 1995 | CS35: =1+RC[-1] -> 1996 | CT35: =1+RC[-1] -> 1997 | CU35: =1+RC[-1] -> 1998 | CV35: =1+RC[-1] -> 1999 | CW35: =1+RC[-1] -> 2000
B36: =R[-1]C[99]+1 -> 2001 | C36: =1+RC[-1] -> 2002 | D36: =1+RC[-1] -> 2003 | E36: =1+RC[-1] -> 2004 | F36: =1+RC[-1] -> 2005 | G36: =1+RC[-1] -> 2006 | H36: =1+RC[-1] -> 2007 | I36: =1+RC[-1] -> 2008 | J36: =1+RC[-1] -> 2009 | K36: =1+RC[-1] -> 2010 | L36: =1+RC[-1] -> 2011 | M36: =1+RC[-1] -> 2012 | N36: =1+RC[-1] -> 2013 | O36: =1+RC[-1] -> 2014 | P36: =1+RC[-1] -> 2015 | Q36: =1+RC[-1] -> 2016 | R36: =1+RC[-1] -> 2017 | S36: =1+RC[-1] -> 2018 | T36: =1+RC[-1] -> 2019 | U36: =1+RC[-1] -> 2020 | V36: =1+RC[-1] -> 2021 | W36: =1+RC[-1] -> 2022 | X36: =1+RC[-1] -> 2023 | Y36: =1+RC[-1] -> 2024 | Z36: =1+RC[-1] -> 2025 | AA36: =1+RC[-1] -> 2026 | AB36: =1+RC[-1] -> 2027 | AC36: =1+RC[-1] -> 2028 | AD36: =1+RC[-1] -> 2029 | AE36: =1+RC[-1] -> 2030 | AF36: =1+RC[-1] -> 2031 | AG36: =1+RC[-1] -> 2032 | AH36: =1+RC[-1] -> 2033 | AI36: =1+RC[-1] -> 2034 | AJ36: =1+RC[-1] -> 2035 | AK36: =1+RC[-1] -> 2036 | AL36: =1+RC[-1] -> 2037 | AM36: =1+RC[-1] -> 2038 | AN36: =1+RC[-1] -> 2039 | AO36: =1+RC[-1] -> 2040 | AP36: =1+RC[-1] -> 2041 | AQ36: =1+RC[-1] -> 2042 | AR36: =1+RC[-1] -> 2043 | AS36: =1+RC[-1] -> 2044 | AT36: =1+RC[-1] -> 2045 | AU36: =1+RC[-1] -> 2046 | AV36: =1+RC[-1] -> 2047 | AW36: =1+RC[-1] -> 2048 | AX36: =1+RC[-1] -> 2049 | AY36: =1+RC[-1] -> 2050 | AZ36: =1+RC[-1] -> 2051 | BA36: =1+RC[-1] -> 2052 | BB36: =1+RC[-1] -> 2053 | BC36: =1+RC[-1] -> 2054 | BD36: =1+RC[-1] -> 2055 | BE36: =1+RC[-1] -> 2056 | BF36: =1+RC[-1] -> 2057 | BG36: =1+RC[-1] -> 2058 | BH36: =1+RC[-1] -> 2059 | BI36: =1+RC[-1] -> 2060 | BJ36: =1+RC[-1] -> 2061 | BK36: =1+RC[-1] -> 2062 | BL36: =1+RC[-1] -> 2063 | BM36: =1+RC[-1] -> 2064 | BN36: =1+RC[-1] -> 2065 | BO36: =1+RC[-1] -> 2066 | BP36: =1+RC[-1] -> 2067 | BQ36: =1+RC[-1] -> 2068 | BR36: =1+RC[-1] -> 2069 | BS36: =1+RC[-1] -> 2070 | BT36: =1+RC[-1] -> 2071 | BU36: =1+RC[-1] -> 2072 | BV36: =1+RC[-1] -> 2073 | BW36: =1+RC[-1] -> 2074 | BX36: =1+RC[-1] -> 2075 | BY36: =1+RC[-1] -> 2076 | BZ36: =1+RC[-1] -> 2077 | CA36: =1+RC[-1] -> 2078 | CB36: =1+RC[-1] -> 2079 | CC36: =1+RC[-1] -> 2080 | CD36: =1+RC[-1] -> 2081 | CE36: =1+RC[-1] -> 2082 | CF36: =1+RC[-1] -> 2083 | CG36: =1+RC[-1] -> 2084 | CH36: =1+RC[-1] -> 2085 | CI36: =1+RC[-1] -> 2086 | CJ36: =1+RC[-1] -> 2087 | CK36: =1+RC[-1] -> 2088 | CL36: =1+RC[-1] -> 2089 | CM36: =1+RC[-1] -> 2090 | CN36: =1+RC[-1] -> 2091 | CO36: =1+RC[-1] -> 2092 | CP36: =1+RC[-1] -> 2093 | CQ36: =1+RC[-1] -> 2094 | CR36: =1+RC[-1] -> 2095 | CS36: =1+RC[-1] -> 2096 | CT36: =1+RC[-1] -> 2097 | CU36: =1+RC[-1] -> 2098 | CV36: =1+RC[-1] -> 2099 | CW36: =1+RC[-1] -> 2100
B37: =R[-1]C[99]+1 -> 2101 | C37: =1+RC[-1] -> 2102 | D37: =1+RC[-1] -> 2103 | E37: =1+RC[-1] -> 2104 | F37: =1+RC[-1] -> 2105 | G37: =1+RC[-1] -> 2106 | H37: =1+RC[-1] -> 2107 | I37: =1+RC[-1] -> 2108 | J37: =1+RC[-1] -> 2109 | K37: =1+RC[-1] -> 2110 | L37: =1+RC[-1] -> 2111 | M37: =1+RC[-1] -> 2112 | N37: =1+RC[-1] -> 2113 | O37: =1+RC[-1] -> 2114 | P37: =1+RC[-1] -> 2115 | Q37: =1+RC[-1] -> 2116 | R37: =1+RC[-1] -> 2117 | S37: =1+RC[-1] -> 2118 | T37: =1+RC[-1] -> 2119 | U37: =1+RC[-1] -> 2120 | V37: =1+RC[-1] -> 2121 | W37: =1+RC[-1] -> 2122 | X37: =1+RC[-1] -> 2123 | Y37: =1+RC[-1] -> 2124 | Z37: =1+RC[-1] -> 2125 | AA37: =1+RC[-1] -> 2126 | AB37: =1+RC[-1] -> 2127 | AC37: =1+RC[-1] -> 2128 | AD37: =1+RC[-1] -> 2129 | AE37: =1+RC[-1] -> 2130 | AF37: =1+RC[-1] -> 2131 | AG37: =1+RC[-1] -> 2132 | AH37: =1+RC[-1] -> 2133 | AI37: =1+RC[-1] -> 2134 | AJ37: =1+RC[-1] -> 2135 | AK37: =1+RC[-1] -> 2136 | AL37: =1+RC[-1] -> 2137 | AM37: =1+RC[-1] -> 2138 | AN37: =1+RC[-1] -> 2139 | AO37: =1+RC[-1] -> 2140 | AP37: =1+RC[-1] -> 2141 | AQ37: =1+RC[-1] -> 2142 | AR37: =1+RC[-1] -> 2143 | AS37: =1+RC[-1] -> 2144 | AT37: =1+RC[-1] -> 2145 | AU37: =1+RC[-1] -> 2146 | AV37: =1+RC[-1] -> 2147 | AW37: =1+RC[-1] -> 2148 | AX37: =1+RC[-1] -> 2149 | AY37: =1+RC[-1] -> 2150 | AZ37: =1+RC[-1] -> 2151 | BA37: =1+RC[-1] -> 2152 | BB37: =1+RC[-1] -> 2153 | BC37: =1+RC[-1] -> 2154 | BD37: =1+RC[-1] -> 2155 | BE37: =1+RC[-1] -> 2156 | BF37: =1+RC[-1] -> 2157 | BG37: =1+RC[-1] -> 2158 | BH37: =1+RC[-1] -> 2159 | BI37: =1+RC[-1] -> 2160 | BJ37: =1+RC[-1] -> 2161 | BK37: =1+RC[-1] -> 2162 | BL37: =1+RC[-1] -> 2163 | BM37: =1+RC[-1] -> 2164 | BN37: =1+RC[-1] -> 2165 | BO37: =1+RC[-1] -> 2166 | BP37: =1+RC[-1] -> 2167 | BQ37: =1+RC[-1] -> 2168 | BR37: =1+RC[-1] -> 2169 | BS37: =1+RC[-1] -> 2170 | BT37: =1+RC[-1] -> 2171 | BU37: =1+RC[-1] -> 2172 | BV37: =1+RC[-1] -> 2173 | BW37: =1+RC[-1] -> 2174 | BX37: =1+RC[-1] -> 2175 | BY37: =1+RC[-1] -> 2176 | BZ37: =1+RC[-1] -> 2177 | CA37: =1+RC[-1] -> 2178 | CB37: =1+RC[-1] -> 2179 | CC37: =1+RC[-1] -> 2180 | CD37: =1+RC[-1] -> 2181 | CE37: =1+RC[-1] -> 2182 | CF37: =1+RC[-1] -> 2183 | CG37: =1+RC[-1] -> 2184 | CH37: =1+RC[-1] -> 2185 | CI37: =1+RC[-1] -> 2186 | CJ37: =1+RC[-1] -> 2187 | CK37: =1+RC[-1] -> 2188 | CL37: =1+RC[-1] -> 2189 | CM37: =1+RC[-1] -> 2190 | CN37: =1+RC[-1] -> 2191 | CO37: =1+RC[-1] -> 2192 | CP37: =1+RC[-1] -> 2193 | CQ37: =1+RC[-1] -> 2194 | CR37: =1+RC[-1] -> 2195 | CS37: =1+RC[-1] -> 2196 | CT37: =1+RC[-1] -> 2197 | CU37: =1+RC[-1] -> 2198 | CV37: =1+RC[-1] -> 2199 | CW37: =1+RC[-1] -> 2200
B38: =R[-1]C[99]+1 -> 2201 | C38: =1+RC[-1] -> 2202 | D38: =1+RC[-1] -> 2203 | E38: =1+RC[-1] -> 2204 | F38: =1+RC[-1] -> 2205 | G38: =1+RC[-1] -> 2206 | H38: =1+RC[-1] -> 2207 | I38: =1+RC[-1] -> 2208 | J38: =1+RC[-1] -> 2209 | K38: =1+RC[-1] -> 2210 | L38: =1+RC[-1] -> 2211 | M38: =1+RC[-1] -> 2212 | N38: =1+RC[-1] -> 2213 | O38: =1+RC[-1] -> 2214 | P38: =1+RC[-1] -> 2215 | Q38: =1+RC[-1] -> 2216 | R38: =1+RC[-1] -> 2217 | S38: =1+RC[-1] -> 2218 | T38: =1+RC[-1] -> 2219 | U38: =1+RC[-1] -> 2220 | V38: =1+RC[-1] -> 2221 | W38: =1+RC[-1] -> 2222 | X38: =1+RC[-1] -> 2223 | Y38: =1+RC[-1] -> 2224 | Z38: =1+RC[-1] -> 2225 | AA38: =1+RC[-1] -> 2226 | AB38: =1+RC[-1] -> 2227 | AC38: =1+RC[-1] -> 2228 | AD38: =1+RC[-1] -> 2229 | AE38: =1+RC[-1] -> 2230 | AF38: =1+RC[-1] -> 2231 | AG38: =1+RC[-1] -> 2232 | AH38: =1+RC[-1] -> 2233 | AI38: =1+RC[-1] -> 2234 | AJ38: =1+RC[-1] -> 2235 | AK38: =1+RC[-1] -> 2236 | AL38: =1+RC[-1] -> 2237 | AM38: =1+RC[-1] -> 2238 | AN38: =1+RC[-1] -> 2239 | AO38: =1+RC[-1] -> 2240 | AP38: =1+RC[-1] -> 2241 | AQ38: =1+RC[-1] -> 2242 | AR38: =1+RC[-1] -> 2243 | AS38: =1+RC[-1] -> 2244 | AT38: =1+RC[-1] -> 2245 | AU38: =1+RC[-1] -> 2246 | AV38: =1+RC[-1] -> 2247 | AW38: =1+RC[-1] -> 2248 | AX38: =1+RC[-1] -> 2249 | AY38: =1+RC[-1] -> 2250 | AZ38: =1+RC[-1] -> 2251 | BA38: =1+RC[-1] -> 2252 | BB38: =1+RC[-1] -> 2253 | BC38: =1+RC[-1] -> 2254 | BD38: =1+RC[-1] -> 2255 | BE38: =1+RC[-1] -> 2256 | BF38: =1+RC[-1] -> 2257 | BG38: =1+RC[-1] -> 2258 | BH38: =1+RC[-1] -> 2259 | BI38: =1+RC[-1] -> 2260 | BJ38: =1+RC[-1] -> 2261 | BK38: =1+RC[-1] -> 2262 | BL38: =1+RC[-1] -> 2263 | BM38: =1+RC[-1] -> 2264 | BN38: =1+RC[-1] -> 2265 | BO38: =1+RC[-1] -> 2266 | BP38: =1+RC[-1] -> 2267 | BQ38: =1+RC[-1] -> 2268 | BR38: =1+RC[-1] -> 2269 | BS38: =1+RC[-1] -> 2270 | BT38: =1+RC[-1] -> 2271 | BU38: =1+RC[-1] -> 2272 | BV38: =1+RC[-1] -> 2273 | BW38: =1+RC[-1] -> 2274 | BX38: =1+RC[-1] -> 2275 | BY38: =1+RC[-1] -> 2276 | BZ38: =1+RC[-1] -> 2277 | CA38: =1+RC[-1] -> 2278 | CB38: =1+RC[-1] -> 2279 | CC38: =1+RC[-1] -> 2280 | CD38: =1+RC[-1] -> 2281 | CE38: =1+RC[-1] -> 2282 | CF38: =1+RC[-1] -> 2283 | CG38: =1+RC[-1] -> 2284 | CH38: =1+RC[-1] -> 2285 | CI38: =1+RC[-1] -> 2286 | CJ38: =1+RC[-1] -> 2287 | CK38: =1+RC[-1] -> 2288 | CL38: =1+RC[-1] -> 2289 | CM38: =1+RC[-1] -> 2290 | CN38: =1+RC[-1] -> 2291 | CO38: =1+RC[-1] -> 2292 | CP38: =1+RC[-1] -> 2293 | CQ38: =1+RC[-1] -> 2294 | CR38: =1+RC[-1] -> 2295 | CS38: =1+RC[-1] -> 2296 | CT38: =1+RC[-1] -> 2297 | CU38: =1+RC[-1] -> 2298 | CV38: =1+RC[-1] -> 2299 | CW38: =1+RC[-1] -> 2300
B39: =R[-1]C[99]+1 -> 2301 | C39: =1+RC[-1] -> 2302 | D39: =1+RC[-1] -> 2303 | E39: =1+RC[-1] -> 2304 | F39: =1+RC[-1] -> 2305 | G39: =1+RC[-1] -> 2306 | H39: =1+RC[-1] -> 2307 | I39: =1+RC[-1] -> 2308 | J39: =1+RC[-1] -> 2309 | K39: =1+RC[-1] -> 2310 | L39: =1+RC[-1] -> 2311 | M39: =1+RC[-1] -> 2312 | N39: =1+RC[-1] -> 2313 | O39: =1+RC[-1] -> 2314 | P39: =1+RC[-1] -> 2315 | Q39: =1+RC[-1] -> 2316 | R39: =1+RC[-1] -> 2317 | S39: =1+RC[-1] -> 2318 | T39: =1+RC[-1] -> 2319 | U39: =1+RC[-1] -> 2320 | V39: =1+RC[-1] -> 2321 | W39: =1+RC[-1] -> 2322 | X39: =1+RC[-1] -> 2323 | Y39: =1+RC[-1] -> 2324 | Z39: =1+RC[-1] -> 2325 | AA39: =1+RC[-1] -> 2326 | AB39: =1+RC[-1] -> 2327 | AC39: =1+RC[-1] -> 2328 | AD39: =1+RC[-1] -> 2329 | AE39: =1+RC[-1] -> 2330 | AF39: =1+RC[-1] -> 2331 | AG39: =1+RC[-1] -> 2332 | AH39: =1+RC[-1] -> 2333 | AI39: =1+RC[-1] -> 2334 | AJ39: =1+RC[-1] -> 2335 | AK39: =1+RC[-1] -> 2336 | AL39: =1+RC[-1] -> 2337 | AM39: =1+RC[-1] -> 2338 | AN39: =1+RC[-1] -> 2339 | AO39: =1+RC[-1] -> 2340 | AP39: =1+RC[-1] -> 2341 | AQ39: =1+RC[-1] -> 2342 | AR39: =1+RC[-1] -> 2343 | AS39: =1+RC[-1] -> 2344 | AT39: =1+RC[-1] -> 2345 | AU39: =1+RC[-1] -> 2346 | AV39: =1+RC[-1] -> 2347 | AW39: =1+RC[-1] -> 2348 | AX39: =1+RC[-1] -> 2349 | AY39: =1+RC[-1] -> 2350 | AZ39: =1+RC[-1] -> 2351 | BA39: =1+RC[-1] -> 2352 | BB39: =1+RC[-1] -> 2353 | BC39: =1+RC[-1] -> 2354 | BD39: =1+RC[-1] -> 2355 | BE39: =1+RC[-1] -> 2356 | BF39: =1+RC[-1] -> 2357 | BG39: =1+RC[-1] -> 2358 | BH39: =1+RC[-1] -> 2359 | BI39: =1+RC[-1] -> 2360 | BJ39: =1+RC[-1] -> 2361 | BK39: =1+RC[-1] -> 2362 | BL39: =1+RC[-1] -> 2363 | BM39: =1+RC[-1] -> 2364 | BN39: =1+RC[-1] -> 2365 | BO39: =1+RC[-1] -> 2366 | BP39: =1+RC[-1] -> 2367 | BQ39: =1+RC[-1] -> 2368 | BR39: =1+RC[-1] -> 2369 | BS39: =1+RC[-1] -> 2370 | BT39: =1+RC[-1] -> 2371 | BU39: =1+RC[-1] -> 2372 | BV39: =1+RC[-1] -> 2373 | BW39: =1+RC[-1] -> 2374 | BX39: =1+RC[-1] -> 2375 | BY39: =1+RC[-1] -> 2376 | BZ39: =1+RC[-1] -> 2377 | CA39: =1+RC[-1] -> 2378 | CB39: =1+RC[-1] -> 2379 | CC39: =1+RC[-1] -> 2380 | CD39: =1+RC[-1] -> 2381 | CE39: =1+RC[-1] -> 2382 | CF39: =1+RC[-1] -> 2383 | CG39: =1+RC[-1] -> 2384 | CH39: =1+RC[-1] -> 2385 | CI39: =1+RC[-1] -> 2386 | CJ39: =1+RC[-1] -> 2387 | CK39: =1+RC[-1] -> 2388 | CL39: =1+RC[-1] -> 2389 | CM39: =1+RC[-1] -> 2390 | CN39: =1+RC[-1] -> 2391 | CO39: =1+RC[-1] -> 2392 | CP39: =1+RC[-1] -> 2393 | CQ39: =1+RC[-1] -> 2394 | CR39: =1+RC[-1] -> 2395 | CS39: =1+RC[-1] -> 2396 | CT39: =1+RC[-1] -> 2397 | CU39: =1+RC[-1] -> 2398 | CV39: =1+RC[-1] -> 2399 | CW39: =1+RC[-1] -> 2400
B40: =R[-1]C[99]+1 -> 2401 | C40: =1+RC[-1] -> 2402 | D40: =1+RC[-1] -> 2403 | E40: =1+RC[-1] -> 2404 | F40: =1+RC[-1] -> 2405 | G40: =1+RC[-1] -> 2406 | H40: =1+RC[-1] -> 2407 | I40: =1+RC[-1] -> 2408 | J40: =1+RC[-1] -> 2409 | K40: =1+RC[-1] -> 2410 | L40: =1+RC[-1] -> 2411 | M40: =1+RC[-1] -> 2412 | N40: =1+RC[-1] -> 2413 | O40: =1+RC[-1] -> 2414 | P40: =1+RC[-1] -> 2415 | Q40: =1+RC[-1] -> 2416 | R40: =1+RC[-1] -> 2417 | S40: =1+RC[-1] -> 2418 | T40: =1+RC[-1] -> 2419 | U40: =1+RC[-1] -> 2420 | V40: =1+RC[-1] -> 2421 | W40: =1+RC[-1] -> 2422 | X40: =1+RC[-1] -> 2423 | Y40: =1+RC[-1] -> 2424 | Z40: =1+RC[-1] -> 2425 | AA40: =1+RC[-1] -> 2426 | AB40: =1+RC[-1] -> 2427 | AC40: =1+RC[-1] -> 2428 | AD40: =1+RC[-1] -> 2429 | AE40: =1+RC[-1] -> 2430 | AF40: =1+RC[-1] -> 2431 | AG40: =1+RC[-1] -> 2432 | AH40: =1+RC[-1] -> 2433 | AI40: =1+RC[-1] -> 2434 | AJ40: =1+RC[-1] -> 2435 | AK40: =1+RC[-1] -> 2436 | AL40: =1+RC[-1] -> 2437 | AM40: =1+RC[-1] -> 2438 | AN40: =1+RC[-1] -> 2439 | AO40: =1+RC[-1] -> 2440 | AP40: =1+RC[-1] -> 2441 | AQ40: =1+RC[-1] -> 2442 | AR40: =1+RC[-1] -> 2443 | AS40: =1+RC[-1] -> 2444 | AT40: =1+RC[-1] -> 2445 | AU40: =1+RC[-1] -> 2446 | AV40: =1+RC[-1] -> 2447 | AW40: =1+RC[-1] -> 2448 | AX40: =1+RC[-1] -> 2449 | AY40: =1+RC[-1] -> 2450 | AZ40: =1+RC[-1] -> 2451 | BA40: =1+RC[-1] -> 2452 | BB40: =1+RC[-1] -> 2453 | BC40: =1+RC[-1] -> 2454 | BD40: =1+RC[-1] -> 2455 | BE40: =1+RC[-1] -> 2456 | BF40: =1+RC[-1] -> 2457 | BG40: =1+RC[-1] -> 2458 | BH40: =1+RC[-1] -> 2459 | BI40: =1+RC[-1] -> 2460 | BJ40: =1+RC[-1] -> 2461 | BK40: =1+RC[-1] -> 2462 | BL40: =1+RC[-1] -> 2463 | BM40: =1+RC[-1] -> 2464 | BN40: =1+RC[-1] -> 2465 | BO40: =1+RC[-1] -> 2466 | BP40: =1+RC[-1] -> 2467 | BQ40: =1+RC[-1] -> 2468 | BR40: =1+RC[-1] -> 2469 | BS40: =1+RC[-1] -> 2470 | BT40: =1+RC[-1] -> 2471 | BU40: =1+RC[-1] -> 2472 | BV40: =1+RC[-1] -> 2473 | BW40: =1+RC[-1] -> 2474 | BX40: =1+RC[-1] -> 2475 | BY40: =1+RC[-1] -> 2476 | BZ40: =1+RC[-1] -> 2477 | CA40: =1+RC[-1] -> 2478 | CB40: =1+RC[-1] -> 2479 | CC40: =1+RC[-1] -> 2480 | CD40: =1+RC[-1] -> 2481 | CE40: =1+RC[-1] -> 2482 | CF40: =1+RC[-1] -> 2483 | CG40: =1+RC[-1] -> 2484 | CH40: =1+RC[-1] -> 2485 | CI40: =1+RC[-1] -> 2486 | CJ40: =1+RC[-1] -> 2487 | CK40: =1+RC[-1] -> 2488 | CL40: =1+RC[-1] -> 2489 | CM40: =1+RC[-1] -> 2490 | CN40: =1+RC[-1] -> 2491 | CO40: =1+RC[-1] -> 2492 | CP40: =1+RC[-1] -> 2493 | CQ40: =1+RC[-1] -> 2494 | CR40: =1+RC[-1] -> 2495 | CS40: =1+RC[-1] -> 2496 | CT40: =1+RC[-1] -> 2497 | CU40: =1+RC[-1] -> 2498 | CV40: =1+RC[-1] -> 2499 | CW40: =1+RC[-1] -> 2500
B41: =R[-1]C[99]+1 -> 2501 | C41: =1+RC[-1] -> 2502 | D41: =1+RC[-1] -> 2503 | E41: =1+RC[-1] -> 2504 | F41: =1+RC[-1] -> 2505 | G41: =1+RC[-1] -> 2506 | H41: =1+RC[-1] -> 2507 | I41: =1+RC[-1] -> 2508 | J41: =1+RC[-1] -> 2509 | K41: =1+RC[-1] -> 2510 | L41: =1+RC[-1] -> 2511 | M41: =1+RC[-1] -> 2512 | N41: =1+RC[-1] -> 2513 | O41: =1+RC[-1] -> 2514 | P41: =1+RC[-1] -> 2515 | Q41: =1+RC[-1] -> 2516 | R41: =1+RC[-1] -> 2517 | S41: =1+RC[-1] -> 2518 | T41: =1+RC[-1] -> 2519 | U41: =1+RC[-1] -> 2520 | V41: =1+RC[-1] -> 2521 | W41: =1+RC[-1] -> 2522 | X41: =1+RC[-1] -> 2523 | Y41: =1+RC[-1] -> 2524 | Z41: =1+RC[-1] -> 2525 | AA41: =1+RC[-1] -> 2526 | AB41: =1+RC[-1] -> 2527 | AC41: =1+RC[-1] -> 2528 | AD41: =1+RC[-1] -> 2529 | AE41: =1+RC[-1] -> 2530 | AF41: =1+RC[-1] -> 2531 | AG41: =1+RC[-1] -> 2532 | AH41: =1+RC[-1] -> 2533 | AI41: =1+RC[-1] -> 2534 | AJ41: =1+RC[-1] -> 2535 | AK41: =1+RC[-1] -> 2536 | AL41: =1+RC[-1] -> 2537 | AM41: =1+RC[-1] -> 2538 | AN41: =1+RC[-1] -> 2539 | AO41: =1+RC[-1] -> 2540 | AP41: =1+RC[-1] -> 2541 | AQ41: =1+RC[-1] -> 2542 | AR41: =1+RC[-1] -> 2543 | AS41: =1+RC[-1] -> 2544 | AT41: =1+RC[-1] -> 2545 | AU41: =1+RC[-1] -> 2546 | AV41: =1+RC[-1] -> 2547 | AW41: =1+RC[-1] -> 2548 | AX41: =1+RC[-1] -> 2549 | AY41: =1+RC[-1] -> 2550 | AZ41: =1+RC[-1] -> 2551 | BA41: =1+RC[-1] -> 2552 | BB41: =1+RC[-1] -> 2553 | BC41: =1+RC[-1] -> 2554 | BD41: =1+RC[-1] -> 2555 | BE41: =1+RC[-1] -> 2556 | BF41: =1+RC[-1] -> 2557 | BG41: =1+RC[-1] -> 2558 | BH41: =1+RC[-1] -> 2559 | BI41: =1+RC[-1] -> 2560 | BJ41: =1+RC[-1] -> 2561 | BK41: =1+RC[-1] -> 2562 | BL41: =1+RC[-1] -> 2563 | BM41: =1+RC[-1] -> 2564 | BN41: =1+RC[-1] -> 2565 | BO41: =1+RC[-1] -> 2566 | BP41: =1+RC[-1] -> 2567 | BQ41: =1+RC[-1] -> 2568 | BR41: =1+RC[-1] -> 2569 | BS41: =1+RC[-1] -> 2570 | BT41: =1+RC[-1] -> 2571 | BU41: =1+RC[-1] -> 2572 | BV41: =1+RC[-1] -> 2573 | BW41: =1+RC[-1] -> 2574 | BX41: =1+RC[-1] -> 2575 | BY41: =1+RC[-1] -> 2576 | BZ41: =1+RC[-1] -> 2577 | CA41: =1+RC[-1] -> 2578 | CB41: =1+RC[-1] -> 2579 | CC41: =1+RC[-1] -> 2580 | CD41: =1+RC[-1] -> 2581 | CE41: =1+RC[-1] -> 2582 | CF41: =1+RC[-1] -> 2583 | CG41: =1+RC[-1] -> 2584 | CH41: =1+RC[-1] -> 2585 | CI41: =1+RC[-1] -> 2586 | CJ41: =1+RC[-1] -> 2587 | CK41: =1+RC[-1] -> 2588 | CL41: =1+RC[-1] -> 2589 | CM41: =1+RC[-1] -> 2590 | CN41: =1+RC[-1] -> 2591 | CO41: =1+RC[-1] -> 2592 | CP41: =1+RC[-1] -> 2593 | CQ41: =1+RC[-1] -> 2594 | CR41: =1+RC[-1] -> 2595 | CS41: =1+RC[-1] -> 2596 | CT41: =1+RC[-1] -> 2597 | CU41: =1+RC[-1] -> 2598 | CV41: =1+RC[-1] -> 2599 | CW41: =1+RC[-1] -> 2600
B42: =R[-1]C[99]+1 -> 2601 | C42: =1+RC[-1] -> 2602 | D42: =1+RC[-1] -> 2603 | E42: =1+RC[-1] -> 2604 | F42: =1+RC[-1] -> 2605 | G42: =1+RC[-1] -> 2606 | H42: =1+RC[-1] -> 2607 | I42: =1+RC[-1] -> 2608 | J42: =1+RC[-1] -> 2609 | K42: =1+RC[-1] -> 2610 | L42: =1+RC[-1] -> 2611 | M42: =1+RC[-1] -> 2612 | N42: =1+RC[-1] -> 2613 | O42: =1+RC[-1] -> 2614 | P42: =1+RC[-1] -> 2615 | Q42: =1+RC[-1] -> 2616 | R42: =1+RC[-1] -> 2617 | S42: =1+RC[-1] -> 2618 | T42: =1+RC[-1] -> 2619 | U42: =1+RC[-1] -> 2620 | V42: =1+RC[-1] -> 2621 | W42: =1+RC[-1] -> 2622 | X42: =1+RC[-1] -> 2623 | Y42: =1+RC[-1] -> 2624 | Z42: =1+RC[-1] -> 2625 | AA42: =1+RC[-1] -> 2626 | AB42: =1+RC[-1] -> 2627 | AC42: =1+RC[-1] -> 2628 | AD42: =1+RC[-1] -> 2629 | AE42: =1+RC[-1] -> 2630 | AF42: =1+RC[-1] -> 2631 | AG42: =1+RC[-1] -> 2632 | AH42: =1+RC[-1] -> 2633 | AI42: =1+RC[-1] -> 2634 | AJ42: =1+RC[-1] -> 2635 | AK42: =1+RC[-1] -> 2636 | AL42: =1+RC[-1] -> 2637 | AM42: =1+RC[-1] -> 2638 | AN42: =1+RC[-1] -> 2639 | AO42: =1+RC[-1] -> 2640 | AP42: =1+RC[-1] -> 2641 | AQ42: =1+RC[-1] -> 2642 | AR42: =1+RC[-1] -> 2643 | AS42: =1+RC[-1] -> 2644 | AT42: =1+RC[-1] -> 2645 | AU42: =1+RC[-1] -> 2646 | AV42: =1+RC[-1] -> 2647 | AW42: =1+RC[-1] -> 2648 | AX42: =1+RC[-1] -> 2649 | AY42: =1+RC[-1] -> 2650 | AZ42: =1+RC[-1] -> 2651 | BA42: =1+RC[-1] -> 2652 | BB42: =1+RC[-1] -> 2653 | BC42: =1+RC[-1] -> 2654 | BD42: =1+RC[-1] -> 2655 | BE42: =1+RC[-1] -> 2656 | BF42: =1+RC[-1] -> 2657 | BG42: =1+RC[-1] -> 2658 | BH42: =1+RC[-1] -> 2659 | BI42: =1+RC[-1] -> 2660 | BJ42: =1+RC[-1] -> 2661 | BK42: =1+RC[-1] -> 2662 | BL42: =1+RC[-1] -> 2663 | BM42: =1+RC[-1] -> 2664 | BN42: =1+RC[-1] -> 2665 | BO42: =1+RC[-1] -> 2666 | BP42: =1+RC[-1] -> 2667 | BQ42: =1+RC[-1] -> 2668 | BR42: =1+RC[-1] -> 2669 | BS42: =1+RC[-1] -> 2670 | BT42: =1+RC[-1] -> 2671 | BU42: =1+RC[-1] -> 2672 | BV42: =1+RC[-1] -> 2673 | BW42: =1+RC[-1] -> 2674 | BX42: =1+RC[-1] -> 2675 | BY42: =1+RC[-1] -> 2676 | BZ42: =1+RC[-1] -> 2677 | CA42: =1+RC[-1] -> 2678 | CB42: =1+RC[-1] -> 2679 | CC42: =1+RC[-1] -> 2680 | CD42: =1+RC[-1] -> 2681 | CE42: =1+RC[-1] -> 2682 | CF42: =1+RC[-1] -> 2683 | CG42: =1+RC[-1] -> 2684 | CH42: =1+RC[-1] -> 2685 | CI42: =1+RC[-1] -> 2686 | CJ42: =1+RC[-1] -> 2687 | CK42: =1+RC[-1] -> 2688 | CL42: =1+RC[-1] -> 2689 | CM42: =1+RC[-1] -> 2690 | CN42: =1+RC[-1] -> 2691 | CO42: =1+RC[-1] -> 2692 | CP42: =1+RC[-1] -> 2693 | CQ42: =1+RC[-1] -> 2694 | CR42: =1+RC[-1] -> 2695 | CS42: =1+RC[-1] -> 2696 | CT42: =1+RC[-1] -> 2697 | CU42: =1+RC[-1] -> 2698 | CV42: =1+RC[-1] -> 2699 | CW42: =1+RC[-1] -> 2700
B43: =R[-1]C[99]+1 -> 2701 | C43: =1+RC[-1] -> 2702 | D43: =1+RC[-1] -> 2703 | E43: =1+RC[-1] -> 2704 | F43: =1+RC[-1] -> 2705 | G43: =1+RC[-1] -> 2706 | H43: =1+RC[-1] -> 2707 | I43: =1+RC[-1] -> 2708 | J43: =1+RC[-1] -> 2709 | K43: =1+RC[-1] -> 2710 | L43: =1+RC[-1] -> 2711 | M43: =1+RC[-1] -> 2712 | N43: =1+RC[-1] -> 2713 | O43: =1+RC[-1] -> 2714 | P43: =1+RC[-1] -> 2715 | Q43: =1+RC[-1] -> 2716 | R43: =1+RC[-1] -> 2717 | S43: =1+RC[-1] -> 2718 | T43: =1+RC[-1] -> 2719 | U43: =1+RC[-1] -> 2720 | V43: =1+RC[-1] -> 2721 | W43: =1+RC[-1] -> 2722 | X43: =1+RC[-1] -> 2723 | Y43: =1+RC[-1] -> 2724 | Z43: =1+RC[-1] -> 2725 | AA43: =1+RC[-1] -> 2726 | AB43: =1+RC[-1] -> 2727 | AC43: =1+RC[-1] -> 2728 | AD43: =1+RC[-1] -> 2729 | AE43: =1+RC[-1] -> 2730 | AF43: =1+RC[-1] -> 2731 | AG43: =1+RC[-1] -> 2732 | AH43: =1+RC[-1] -> 2733 | AI43: =1+RC[-1] -> 2734 | AJ43: =1+RC[-1] -> 2735 | AK43: =1+RC[-1] -> 2736 | AL43: =1+RC[-1] -> 2737 | AM43: =1+RC[-1] -> 2738 | AN43: =1+RC[-1] -> 2739 | AO43: =1+RC[-1] -> 2740 | AP43: =1+RC[-1] -> 2741 | AQ43: =1+RC[-1] -> 2742 | AR43: =1+RC[-1] -> 2743 | AS43: =1+RC[-1] -> 2744 | AT43: =1+RC[-1] -> 2745 | AU43: =1+RC[-1] -> 2746 | AV43: =1+RC[-1] -> 2747 | AW43: =1+RC[-1] -> 2748 | AX43: =1+RC[-1] -> 2749 | AY43: =1+RC[-1] -> 2750 | AZ43: =1+RC[-1] -> 2751 | BA43: =1+RC[-1] -> 2752 | BB43: =1+RC[-1] -> 2753 | BC43: =1+RC[-1] -> 2754 | BD43: =1+RC[-1] -> 2755 | BE43: =1+RC[-1] -> 2756 | BF43: =1+RC[-1] -> 2757 | BG43: =1+RC[-1] -> 2758 | BH43: =1+RC[-1] -> 2759 | BI43: =1+RC[-1] -> 2760 | BJ43: =1+RC[-1] -> 2761 | BK43: =1+RC[-1] -> 2762 | BL43: =1+RC[-1] -> 2763 | BM43: =1+RC[-1] -> 2764 | BN43: =1+RC[-1] -> 2765 | BO43: =1+RC[-1] -> 2766 | BP43: =1+RC[-1] -> 2767 | BQ43: =1+RC[-1] -> 2768 | BR43: =1+RC[-1] -> 2769 | BS43: =1+RC[-1] -> 2770 | BT43: =1+RC[-1] -> 2771 | BU43: =1+RC[-1] -> 2772 | BV43: =1+RC[-1] -> 2773 | BW43: =1+RC[-1] -> 2774 | BX43: =1+RC[-1] -> 2775 | BY43: =1+RC[-1] -> 2776 | BZ43: =1+RC[-1] -> 2777 | CA43: =1+RC[-1] -> 2778 | CB43: =1+RC[-1] -> 2779 | CC43: =1+RC[-1] -> 2780 | CD43: =1+RC[-1] -> 2781 | CE43: =1+RC[-1] -> 2782 | CF43: =1+RC[-1] -> 2783 | CG43: =1+RC[-1] -> 2784 | CH43: =1+RC[-1] -> 2785 | CI43: =1+RC[-1] -> 2786 | CJ43: =1+RC[-1] -> 2787 | CK43: =1+RC[-1] -> 2788 | CL43: =1+RC[-1] -> 2789 | CM43: =1+RC[-1] -> 2790 | CN43: =1+RC[-1] -> 2791 | CO43: =1+RC[-1] -> 2792 | CP43: =1+RC[-1] -> 2793 | CQ43: =1+RC[-1] -> 2794 | CR43: =1+RC[-1] -> 2795 | CS43: =1+RC[-1] -> 2796 | CT43: =1+RC[-1] -> 2797 | CU43: =1+RC[-1] -> 2798 | CV43: =1+RC[-1] -> 2799 | CW43: =1+RC[-1] -> 2800
B44: =R[-1]C[99]+1 -> 2801 | C44: =1+RC[-1] -> 2802 | D44: =1+RC[-1] -> 2803 | E44: =1+RC[-1] -> 2804 | F44: =1+RC[-1] -> 2805 | G44: =1+RC[-1] -> 2806 | H44: =1+RC[-1] -> 2807 | I44: =1+RC[-1] -> 2808 | J44: =1+RC[-1] -> 2809 | K44: =1+RC[-1] -> 2810 | L44: =1+RC[-1] -> 2811 | M44: =1+RC[-1] -> 2812 | N44: =1+RC[-1] -> 2813 | O44: =1+RC[-1] -> 2814 | P44: =1+RC[-1] -> 2815 | Q44: =1+RC[-1] -> 2816 | R44: =1+RC[-1] -> 2817 | S44: =1+RC[-1] -> 2818 | T44: =1+RC[-1] -> 2819 | U44: =1+RC[-1] -> 2820 | V44: =1+RC[-1] -> 2821 | W44: =1+RC[-1] -> 2822 | X44: =1+RC[-1] -> 2823 | Y44: =1+RC[-1] -> 2824 | Z44: =1+RC[-1] -> 2825 | AA44: =1+RC[-1] -> 2826 | AB44: =1+RC[-1] -> 2827 | AC44: =1+RC[-1] -> 2828 | AD44: =1+RC[-1] -> 2829 | AE44: =1+RC[-1] -> 2830 | AF44: =1+RC[-1] -> 2831 | AG44: =1+RC[-1] -> 2832 | AH44: =1+RC[-1] -> 2833 | AI44: =1+RC[-1] -> 2834 | AJ44: =1+RC[-1] -> 2835 | AK44: =1+RC[-1] -> 2836 | AL44: =1+RC[-1] -> 2837 | AM44: =1+RC[-1] -> 2838 | AN44: =1+RC[-1] -> 2839 | AO44: =1+RC[-1] -> 2840 | AP44: =1+RC[-1] -> 2841 | AQ44: =1+RC[-1] -> 2842 | AR44: =1+RC[-1] -> 2843 | AS44: =1+RC[-1] -> 2844 | AT44: =1+RC[-1] -> 2845 | AU44: =1+RC[-1] -> 2846 | AV44: =1+RC[-1] -> 2847 | AW44: =1+RC[-1] -> 2848 | AX44: =1+RC[-1] -> 2849 | AY44: =1+RC[-1] -> 2850 | AZ44: =1+RC[-1] -> 2851 | BA44: =1+RC[-1] -> 2852 | BB44: =1+RC[-1] -> 2853 | BC44: =1+RC[-1] -> 2854 | BD44: =1+RC[-1] -> 2855 | BE44: =1+RC[-1] -> 2856 | BF44: =1+RC[-1] -> 2857 | BG44: =1+RC[-1] -> 2858 | BH44: =1+RC[-1] -> 2859 | BI44: =1+RC[-1] -> 2860 | BJ44: =1+RC[-1] -> 2861 | BK44: =1+RC[-1] -> 2862 | BL44: =1+RC[-1] -> 2863 | BM44: =1+RC[-1] -> 2864 | BN44: =1+RC[-1] -> 2865 | BO44: =1+RC[-1] -> 2866 | BP44: =1+RC[-1] -> 2867 | BQ44: =1+RC[-1] -> 2868 | BR44: =1+RC[-1] -> 2869 | BS44: =1+RC[-1] -> 2870 | BT44: =1+RC[-1] -> 2871 | BU44: =1+RC[-1] -> 2872 | BV44: =1+RC[-1] -> 2873 | BW44: =1+RC[-1] -> 2874 | BX44: =1+RC[-1] -> 2875 | BY44: =1+RC[-1] -> 2876 | BZ44: =1+RC[-1] -> 2877 | CA44: =1+RC[-1] -> 2878 | CB44: =1+RC[-1] -> 2879 | CC44: =1+RC[-1] -> 2880 | CD44: =1+RC[-1] -> 2881 | CE44: =1+RC[-1] -> 2882 | CF44: =1+RC[-1] -> 2883 | CG44: =1+RC[-1] -> 2884 | CH44: =1+RC[-1] -> 2885 | CI44: =1+RC[-1] -> 2886 | CJ44: =1+RC[-1] -> 2887 | CK44: =1+RC[-1] -> 2888 | CL44: =1+RC[-1] -> 2889 | CM44: =1+RC[-1] -> 2890 | CN44: =1+RC[-1] -> 2891 | CO44: =1+RC[-1] -> 2892 | CP44: =1+RC[-1] -> 2893 | CQ44: =1+RC[-1] -> 2894 | CR44: =1+RC[-1] -> 2895 | CS44: =1+RC[-1] -> 2896 | CT44: =1+RC[-1] -> 2897 | CU44: =1+RC[-1] -> 2898 | CV44: =1+RC[-1] -> 2899 | CW44: =1+RC[-1] -> 2900
B45: =R[-1]C[99]+1 -> 2901 | C45: =1+RC[-1] -> 2902 | D45: =1+RC[-1] -> 2903 | E45: =1+RC[-1] -> 2904 | F45: =1+RC[-1] -> 2905 | G45: =1+RC[-1] -> 2906 | H45: =1+RC[-1] -> 2907 | I45: =1+RC[-1] -> 2908 | J45: =1+RC[-1] -> 2909 | K45: =1+RC[-1] -> 2910 | L45: =1+RC[-1] -> 2911 | M45: =1+RC[-1] -> 2912 | N45: =1+RC[-1] -> 2913 | O45: =1+RC[-1] -> 2914 | P45: =1+RC[-1] -> 2915 | Q45: =1+RC[-1] -> 2916 | R45: =1+RC[-1] -> 2917 | S45: =1+RC[-1] -> 2918 | T45: =1+RC[-1] -> 2919 | U45: =1+RC[-1] -> 2920 | V45: =1+RC[-1] -> 2921 | W45: =1+RC[-1] -> 2922 | X45: =1+RC[-1] -> 2923 | Y45: =1+RC[-1] -> 2924 | Z45: =1+RC[-1] -> 2925 | AA45: =1+RC[-1] -> 2926 | AB45: =1+RC[-1] -> 2927 | AC45: =1+RC[-1] -> 2928 | AD45: =1+RC[-1] -> 2929 | AE45: =1+RC[-1] -> 2930 | AF45: =1+RC[-1] -> 2931 | AG45: =1+RC[-1] -> 2932 | AH45: =1+RC[-1] -> 2933 | AI45: =1+RC[-1] -> 2934 | AJ45: =1+RC[-1] -> 2935 | AK45: =1+RC[-1] -> 2936 | AL45: =1+RC[-1] -> 2937 | AM45: =1+RC[-1] -> 2938 | AN45: =1+RC[-1] -> 2939 | AO45: =1+RC[-1] -> 2940 | AP45: =1+RC[-1] -> 2941 | AQ45: =1+RC[-1] -> 2942 | AR45: =1+RC[-1] -> 2943 | AS45: =1+RC[-1] -> 2944 | AT45: =1+RC[-1] -> 2945 | AU45: =1+RC[-1] -> 2946 | AV45: =1+RC[-1] -> 2947 | AW45: =1+RC[-1] -> 2948 | AX45: =1+RC[-1] -> 2949 | AY45: =1+RC[-1] -> 2950 | AZ45: =1+RC[-1] -> 2951 | BA45: =1+RC[-1] -> 2952 | BB45: =1+RC[-1] -> 2953 | BC45: =1+RC[-1] -> 2954 | BD45: =1+RC[-1] -> 2955 | BE45: =1+RC[-1] -> 2956 | BF45: =1+RC[-1] -> 2957 | BG45: =1+RC[-1] -> 2958 | BH45: =1+RC[-1] -> 2959 | BI45: =1+RC[-1] -> 2960 | BJ45: =1+RC[-1] -> 2961 | BK45: =1+RC[-1] -> 2962 | BL45: =1+RC[-1] -> 2963 | BM45: =1+RC[-1] -> 2964 | BN45: =1+RC[-1] -> 2965 | BO45: =1+RC[-1] -> 2966 | BP45: =1+RC[-1] -> 2967 | BQ45: =1+RC[-1] -> 2968 | BR45: =1+RC[-1] -> 2969 | BS45: =1+RC[-1] -> 2970 | BT45: =1+RC[-1] -> 2971 | BU45: =1+RC[-1] -> 2972 | BV45: =1+RC[-1] -> 2973 | BW45: =1+RC[-1] -> 2974 | BX45: =1+RC[-1] -> 2975 | BY45: =1+RC[-1] -> 2976 | BZ45: =1+RC[-1] -> 2977 | CA45: =1+RC[-1] -> 2978 | CB45: =1+RC[-1] -> 2979 | CC45: =1+RC[-1] -> 2980 | CD45: =1+RC[-1] -> 2981 | CE45: =1+RC[-1] -> 2982 | CF45: =1+RC[-1] -> 2983 | CG45: =1+RC[-1] -> 2984 | CH45: =1+RC[-1] -> 2985 | CI45: =1+RC[-1] -> 2986 | CJ45: =1+RC[-1] -> 2987 | CK45: =1+RC[-1] -> 2988 | CL45: =1+RC[-1] -> 2989 | CM45: =1+RC[-1] -> 2990 | CN45: =1+RC[-1] -> 2991 | CO45: =1+RC[-1] -> 2992 | CP45: =1+RC[-1] -> 2993 | CQ45: =1+RC[-1] -> 2994 | CR45: =1+RC[-1] -> 2995 | CS45: =1+RC[-1] -> 2996 | CT45: =1+RC[-1] -> 2997 | CU45: =1+RC[-1] -> 2998 | CV45: =1+RC[-1] -> 2999 | CW45: =1+RC[-1] -> 3000
B46: =R[-1]C[99]+1 -> 3001 | C46: =1+RC[-1] -> 3002 | D46: =1+RC[-1] -> 3003 | E46: =1+RC[-1] -> 3004 | F46: =1+RC[-1] -> 3005 | G46: =1+RC[-1] -> 3006 | H46: =1+RC[-1] -> 3007 | I46: =1+RC[-1] -> 3008 | J46: =1+RC[-1] -> 3009 | K46: =1+RC[-1] -> 3010 | L46: =1+RC[-1] -> 3011 | M46: =1+RC[-1] -> 3012 | N46: =1+RC[-1] -> 3013 | O46: =1+RC[-1] -> 3014 | P46: =1+RC[-1] -> 3015 | Q46: =1+RC[-1] -> 3016 | R46: =1+RC[-1] -> 3017 | S46: =1+RC[-1] -> 3018 | T46: =1+RC[-1] -> 3019 | U46: =1+RC[-1] -> 3020 | V46: =1+RC[-1] -> 3021 | W46: =1+RC[-1] -> 3022 | X46: =1+RC[-1] -> 3023 | Y46: =1+RC[-1] -> 3024 | Z46: =1+RC[-1] -> 3025 | AA46: =1+RC[-1] -> 3026 | AB46: =1+RC[-1] -> 3027 | AC46: =1+RC[-1] -> 3028 | AD46: =1+RC[-1] -> 3029 | AE46: =1+RC[-1] -> 3030 | AF46: =1+RC[-1] -> 3031 | AG46: =1+RC[-1] -> 3032 | AH46: =1+RC[-1] -> 3033 | AI46: =1+RC[-1] -> 3034 | AJ46: =1+RC[-1] -> 3035 | AK46: =1+RC[-1] -> 3036 | AL46: =1+RC[-1] -> 3037 | AM46: =1+RC[-1] -> 3038 | AN46: =1+RC[-1] -> 3039 | AO46: =1+RC[-1] -> 3040 | AP46: =1+RC[-1] -> 3041 | AQ46: =1+RC[-1] -> 3042 | AR46: =1+RC[-1] -> 3043 | AS46: =1+RC[-1] -> 3044 | AT46: =1+RC[-1] -> 3045 | AU46: =1+RC[-1] -> 3046 | AV46: =1+RC[-1] -> 3047 | AW46: =1+RC[-1] -> 3048 | AX46: =1+RC[-1] -> 3049 | AY46: =1+RC[-1] -> 3050 | AZ46: =1+RC[-1] -> 3051 | BA46: =1+RC[-1] -> 3052 | BB46: =1+RC[-1] -> 3053 | BC46: =1+RC[-1] -> 3054 | BD46: =1+RC[-1] -> 3055 | BE46: =1+RC[-1] -> 3056 | BF46: =1+RC[-1] -> 3057 | BG46: =1+RC[-1] -> 3058 | BH46: =1+RC[-1] -> 3059 | BI46: =1+RC[-1] -> 3060 | BJ46: =1+RC[-1] -> 3061 | BK46: =1+RC[-1] -> 3062 | BL46: =1+RC[-1] -> 3063 | BM46: =1+RC[-1] -> 3064 | BN46: =1+RC[-1] -> 3065 | BO46: =1+RC[-1] -> 3066 | BP46: =1+RC[-1] -> 3067 | BQ46: =1+RC[-1] -> 3068 | BR46: =1+RC[-1] -> 3069 | BS46: =1+RC[-1] -> 3070 | BT46: =1+RC[-1] -> 3071 | BU46: =1+RC[-1] -> 3072 | BV46: =1+RC[-1] -> 3073 | BW46: =1+RC[-1] -> 3074 | BX46: =1+RC[-1] -> 3075 | BY46: =1+RC[-1] -> 3076 | BZ46: =1+RC[-1] -> 3077 | CA46: =1+RC[-1] -> 3078 | CB46: =1+RC[-1] -> 3079 | CC46: =1+RC[-1] -> 3080 | CD46: =1+RC[-1] -> 3081 | CE46: =1+RC[-1] -> 3082 | CF46: =1+RC[-1] -> 3083 | CG46: =1+RC[-1] -> 3084 | CH46: =1+RC[-1] -> 3085 | CI46: =1+RC[-1] -> 3086 | CJ46: =1+RC[-1] -> 3087 | CK46: =1+RC[-1] -> 3088 | CL46: =1+RC[-1] -> 3089 | CM46: =1+RC[-1] -> 3090 | CN46: =1+RC[-1] -> 3091 | CO46: =1+RC[-1] -> 3092 | CP46: =1+RC[-1] -> 3093 | CQ46: =1+RC[-1] -> 3094 | CR46: =1+RC[-1] -> 3095 | CS46: =1+RC[-1] -> 3096 | CT46: =1+RC[-1] -> 3097 | CU46: =1+RC[-1] -> 3098 | CV46: =1+RC[-1] -> 3099 | CW46: =1+RC[-1] -> 3100
B47: =R[-1]C[99]+1 -> 3101 | C47: =1+RC[-1] -> 3102 | D47: =1+RC[-1] -> 3103 | E47: =1+RC[-1] -> 3104 | F47: =1+RC[-1] -> 3105 | G47: =1+RC[-1] -> 3106 | H47: =1+RC[-1] -> 3107 | I47: =1+RC[-1] -> 3108 | J47: =1+RC[-1] -> 3109 | K47: =1+RC[-1] -> 3110 | L47: =1+RC[-1] -> 3111 | M47: =1+RC[-1] -> 3112 | N47: =1+RC[-1] -> 3113 | O47: =1+RC[-1] -> 3114 | P47: =1+RC[-1] -> 3115 | Q47: =1+RC[-1] -> 3116 | R47: =1+RC[-1] -> 3117 | S47: =1+RC[-1] -> 3118 | T47: =1+RC[-1] -> 3119 | U47: =1+RC[-1] -> 3120 | V47: =1+RC[-1] -> 3121 | W47: =1+RC[-1] -> 3122 | X47: =1+RC[-1] -> 3123 | Y47: =1+RC[-1] -> 3124 | Z47: =1+RC[-1] -> 3125 | AA47: =1+RC[-1] -> 3126 | AB47: =1+RC[-1] -> 3127 | AC47: =1+RC[-1] -> 3128 | AD47: =1+RC[-1] -> 3129 | AE47: =1+RC[-1] -> 3130 | AF47: =1+RC[-1] -> 3131 | AG47: =1+RC[-1] -> 3132 | AH47: =1+RC[-1] -> 3133 | AI47: =1+RC[-1] -> 3134 | AJ47: =1+RC[-1] -> 3135 | AK47: =1+RC[-1] -> 3136 | AL47: =1+RC[-1] -> 3137 | AM47: =1+RC[-1] -> 3138 | AN47: =1+RC[-1] -> 3139 | AO47: =1+RC[-1] -> 3140 | AP47: =1+RC[-1] -> 3141 | AQ47: =1+RC[-1] -> 3142 | AR47: =1+RC[-1] -> 3143 | AS47: =1+RC[-1] -> 3144 | AT47: =1+RC[-1] -> 3145 | AU47: =1+RC[-1] -> 3146 | AV47: =1+RC[-1] -> 3147 | AW47: =1+RC[-1] -> 3148 | AX47: =1+RC[-1] -> 3149 | AY47: =1+RC[-1] -> 3150 | AZ47: =1+RC[-1] -> 3151 | BA47: =1+RC[-1] -> 3152 | BB47: =1+RC[-1] -> 3153 | BC47: =1+RC[-1] -> 3154 | BD47: =1+RC[-1] -> 3155 | BE47: =1+RC[-1] -> 3156 | BF47: =1+RC[-1] -> 3157 | BG47: =1+RC[-1] -> 3158 | BH47: =1+RC[-1] -> 3159 | BI47: =1+RC[-1] -> 3160 | BJ47: =1+RC[-1] -> 3161 | BK47: =1+RC[-1] -> 3162 | BL47: =1+RC[-1] -> 3163 | BM47: =1+RC[-1] -> 3164 | BN47: =1+RC[-1] -> 3165 | BO47: =1+RC[-1] -> 3166 | BP47: =1+RC[-1] -> 3167 | BQ47: =1+RC[-1] -> 3168 | BR47: =1+RC[-1] -> 3169 | BS47: =1+RC[-1] -> 3170 | BT47: =1+RC[-1] -> 3171 | BU47: =1+RC[-1] -> 3172 | BV47: =1+RC[-1] -> 3173 | BW47: =1+RC[-1] -> 3174 | BX47: =1+RC[-1] -> 3175 | BY47: =1+RC[-1] -> 3176 | BZ47: =1+RC[-1] -> 3177 | CA47: =1+RC[-1] -> 3178 | CB47: =1+RC[-1] -> 3179 | CC47: =1+RC[-1] -> 3180 | CD47: =1+RC[-1] -> 3181 | CE47: =1+RC[-1] -> 3182 | CF47: =1+RC[-1] -> 3183 | CG47: =1+RC[-1] -> 3184 | CH47: =1+RC[-1] -> 3185 | CI47: =1+RC[-1] -> 3186 | CJ47: =1+RC[-1] -> 3187 | CK47: =1+RC[-1] -> 3188 | CL47: =1+RC[-1] -> 3189 | CM47: =1+RC[-1] -> 3190 | CN47: =1+RC[-1] -> 3191 | CO47: =1+RC[-1] -> 3192 | CP47: =1+RC[-1] -> 3193 | CQ47: =1+RC[-1] -> 3194 | CR47: =1+RC[-1] -> 3195 | CS47: =1+RC[-1] -> 3196 | CT47: =1+RC[-1] -> 3197 | CU47: =1+RC[-1] -> 3198 | CV47: =1+RC[-1] -> 3199 | CW47: =1+RC[-1] -> 3200
B48: =R[-1]C[99]+1 -> 3201 | C48: =1+RC[-1] -> 3202 | D48: =1+RC[-1] -> 3203 | E48: =1+RC[-1] -> 3204 | F48: =1+RC[-1] -> 3205 | G48: =1+RC[-1] -> 3206 | H48: =1+RC[-1] -> 3207 | I48: =1+RC[-1] -> 3208 | J48: =1+RC[-1] -> 3209 | K48: =1+RC[-1] -> 3210 | L48: =1+RC[-1] -> 3211 | M48: =1+RC[-1] -> 3212 | N48: =1+RC[-1] -> 3213 | O48: =1+RC[-1] -> 3214 | P48: =1+RC[-1] -> 3215 | Q48: =1+RC[-1] -> 3216 | R48: =1+RC[-1] -> 3217 | S48: =1+RC[-1] -> 3218 | T48: =1+RC[-1] -> 3219 | U48: =1+RC[-1] -> 3220 | V48: =1+RC[-1] -> 3221 | W48: =1+RC[-1] -> 3222 | X48: =1+RC[-1] -> 3223 | Y48: =1+RC[-1] -> 3224 | Z48: =1+RC[-1] -> 3225 | AA48: =1+RC[-1] -> 3226 | AB48: =1+RC[-1] -> 3227 | AC48: =1+RC[-1] -> 3228 | AD48: =1+RC[-1] -> 3229 | AE48: =1+RC[-1] -> 3230 | AF48: =1+RC[-1] -> 3231 | AG48: =1+RC[-1] -> 3232 | AH48: =1+RC[-1] -> 3233 | AI48: =1+RC[-1] -> 3234 | AJ48: =1+RC[-1] -> 3235 | AK48: =1+RC[-1] -> 3236 | AL48: =1+RC[-1] -> 3237 | AM48: =1+RC[-1] -> 3238 | AN48: =1+RC[-1] -> 3239 | AO48: =1+RC[-1] -> 3240 | AP48: =1+RC[-1] -> 3241 | AQ48: =1+RC[-1] -> 3242 | AR48: =1+RC[-1] -> 3243 | AS48: =1+RC[-1] -> 3244 | AT48: =1+RC[-1] -> 3245 | AU48: =1+RC[-1] -> 3246 | AV48: =1+RC[-1] -> 3247 | AW48: =1+RC[-1] -> 3248 | AX48: =1+RC[-1] -> 3249 | AY48: =1+RC[-1] -> 3250 | AZ48: =1+RC[-1] -> 3251 | BA48: =1+RC[-1] -> 3252 | BB48: =1+RC[-1] -> 3253 | BC48: =1+RC[-1] -> 3254 | BD48: =1+RC[-1] -> 3255 | BE48: =1+RC[-1] -> 3256 | BF48: =1+RC[-1] -> 3257 | BG48: =1+RC[-1] -> 3258 | BH48: =1+RC[-1] -> 3259 | BI48: =1+RC[-1] -> 3260 | BJ48: =1+RC[-1] -> 3261 | BK48: =1+RC[-1] -> 3262 | BL48: =1+RC[-1] -> 3263 | BM48: =1+RC[-1] -> 3264 | BN48: =1+RC[-1] -> 3265 | BO48: =1+RC[-1] -> 3266 | BP48: =1+RC[-1] -> 3267 | BQ48: =1+RC[-1] -> 3268 | BR48: =1+RC[-1] -> 3269 | BS48: =1+RC[-1] -> 3270 | BT48: =1+RC[-1] -> 3271 | BU48: =1+RC[-1] -> 3272 | BV48: =1+RC[-1] -> 3273 | BW48: =1+RC[-1] -> 3274 | BX48: =1+RC[-1] -> 3275 | BY48: =1+RC[-1] -> 3276 | BZ48: =1+RC[-1] -> 3277 | CA48: =1+RC[-1] -> 3278 | CB48: =1+RC[-1] -> 3279 | CC48: =1+RC[-1] -> 3280 | CD48: =1+RC[-1] -> 3281 | CE48: =1+RC[-1] -> 3282 | CF48: =1+RC[-1] -> 3283 | CG48: =1+RC[-1] -> 3284 | CH48: =1+RC[-1] -> 3285 | CI48: =1+RC[-1] -> 3286 | CJ48: =1+RC[-1] -> 3287 | CK48: =1+RC[-1] -> 3288 | CL48: =1+RC[-1] -> 3289 | CM48: =1+RC[-1] -> 3290 | CN48: =1+RC[-1] -> 3291 | CO48: =1+RC[-1] -> 3292 | CP48: =1+RC[-1] -> 3293 | CQ48: =1+RC[-1] -> 3294 | CR48: =1+RC[-1] -> 3295 | CS48: =1+RC[-1] -> 3296 | CT48: =1+RC[-1] -> 3297 | CU48: =1+RC[-1] -> 3298 | CV48: =1+RC[-1] -> 3299 | CW48: =1+RC[-1] -> 3300
B49: =R[-1]C[99]+1 -> 3301 | C49: =1+RC[-1] -> 3302 | D49: =1+RC[-1] -> 3303 | E49: =1+RC[-1] -> 3304 | F49: =1+RC[-1] -> 3305 | G49: =1+RC[-1] -> 3306 | H49: =1+RC[-1] -> 3307 | I49: =1+RC[-1] -> 3308 | J49: =1+RC[-1] -> 3309 | K49: =1+RC[-1] -> 3310 | L49: =1+RC[-1] -> 3311 | M49: =1+RC[-1] -> 3312 | N49: =1+RC[-1] -> 3313 | O49: =1+RC[-1] -> 3314 | P49: =1+RC[-1] -> 3315 | Q49: =1+RC[-1] -> 3316 | R49: =1+RC[-1] -> 3317 | S49: =1+RC[-1] -> 3318 | T49: =1+RC[-1] -> 3319 | U49: =1+RC[-1] -> 3320 | V49: =1+RC[-1] -> 3321 | W49: =1+RC[-1] -> 3322 | X49: =1+RC[-1] -> 3323 | Y49: =1+RC[-1] -> 3324 | Z49: =1+RC[-1] -> 3325 | AA49: =1+RC[-1] -> 3326 | AB49: =1+RC[-1] -> 3327 | AC49: =1+RC[-1] -> 3328 | AD49: =1+RC[-1] -> 3329 | AE49: =1+RC[-1] -> 3330 | AF49: =1+RC[-1] -> 3331 | AG49: =1+RC[-1] -> 3332 | AH49: =1+RC[-1] -> 3333 | AI49: =1+RC[-1] -> 3334 | AJ49: =1+RC[-1] -> 3335 | AK49: =1+RC[-1] -> 3336 | AL49: =1+RC[-1] -> 3337 | AM49: =1+RC[-1] -> 3338 | AN49: =1+RC[-1] -> 3339 | AO49: =1+RC[-1] -> 3340 | AP49: =1+RC[-1] -> 3341 | AQ49: =1+RC[-1] -> 3342 | AR49: =1+RC[-1] -> 3343 | AS49: =1+RC[-1] -> 3344 | AT49: =1+RC[-1] -> 3345 | AU49: =1+RC[-1] -> 3346 | AV49: =1+RC[-1] -> 3347 | AW49: =1+RC[-1] -> 3348 | AX49: =1+RC[-1] -> 3349 | AY49: =1+RC[-1] -> 3350 | AZ49: =1+RC[-1] -> 3351 | BA49: =1+RC[-1] -> 3352 | BB49: =1+RC[-1] -> 3353 | BC49: =1+RC[-1] -> 3354 | BD49: =1+RC[-1] -> 3355 | BE49: =1+RC[-1] -> 3356 | BF49: =1+RC[-1] -> 3357 | BG49: =1+RC[-1] -> 3358 | BH49: =1+RC[-1] -> 3359 | BI49: =1+RC[-1] -> 3360 | BJ49: =1+RC[-1] -> 3361 | BK49: =1+RC[-1] -> 3362 | BL49: =1+RC[-1] -> 3363 | BM49: =1+RC[-1] -> 3364 | BN49: =1+RC[-1] -> 3365 | BO49: =1+RC[-1] -> 3366 | BP49: =1+RC[-1] -> 3367 | BQ49: =1+RC[-1] -> 3368 | BR49: =1+RC[-1] -> 3369 | BS49: =1+RC[-1] -> 3370 | BT49: =1+RC[-1] -> 3371 | BU49: =1+RC[-1] -> 3372 | BV49: =1+RC[-1] -> 3373 | BW49: =1+RC[-1] -> 3374 | BX49: =1+RC[-1] -> 3375 | BY49: =1+RC[-1] -> 3376 | BZ49: =1+RC[-1] -> 3377 | CA49: =1+RC[-1] -> 3378 | CB49: =1+RC[-1] -> 3379 | CC49: =1+RC[-1] -> 3380 | CD49: =1+RC[-1] -> 3381 | CE49: =1+RC[-1] -> 3382 | CF49: =1+RC[-1] -> 3383 | CG49: =1+RC[-1] -> 3384 | CH49: =1+RC[-1] -> 3385 | CI49: =1+RC[-1] -> 3386 | CJ49: =1+RC[-1] -> 3387 | CK49: =1+RC[-1] -> 3388 | CL49: =1+RC[-1] -> 3389 | CM49: =1+RC[-1] -> 3390 | CN49: =1+RC[-1] -> 3391 | CO49: =1+RC[-1] -> 3392 | CP49: =1+RC[-1] -> 3393 | CQ49: =1+RC[-1] -> 3394 | CR49: =1+RC[-1] -> 3395 | CS49: =1+RC[-1] -> 3396 | CT49: =1+RC[-1] -> 3397 | CU49: =1+RC[-1] -> 3398 | CV49: =1+RC[-1] -> 3399 | CW49: =1+RC[-1] -> 3400
B50: =R[-1]C[99]+1 -> 3401 | C50: =1+RC[-1] -> 3402 | D50: =1+RC[-1] -> 3403 | E50: =1+RC[-1] -> 3404 | F50: =1+RC[-1] -> 3405 | G50: =1+RC[-1] -> 3406 | H50: =1+RC[-1] -> 3407 | I50: =1+RC[-1] -> 3408 | J50: =1+RC[-1] -> 3409 | K50: =1+RC[-1] -> 3410 | L50: =1+RC[-1] -> 3411 | M50: =1+RC[-1] -> 3412 | N50: =1+RC[-1] -> 3413 | O50: =1+RC[-1] -> 3414 | P50: =1+RC[-1] -> 3415 | Q50: =1+RC[-1] -> 3416 | R50: =1+RC[-1] -> 3417 | S50: =1+RC[-1] -> 3418 | T50: =1+RC[-1] -> 3419 | U50: =1+RC[-1] -> 3420 | V50: =1+RC[-1] -> 3421 | W50: =1+RC[-1] -> 3422 | X50: =1+RC[-1] -> 3423 | Y50: =1+RC[-1] -> 3424 | Z50: =1+RC[-1] -> 3425 | AA50: =1+RC[-1] -> 3426 | AB50: =1+RC[-1] -> 3427 | AC50: =1+RC[-1] -> 3428 | AD50: =1+RC[-1] -> 3429 | AE50: =1+RC[-1] -> 3430 | AF50: =1+RC[-1] -> 3431 | AG50: =1+RC[-1] -> 3432 | AH50: =1+RC[-1] -> 3433 | AI50: =1+RC[-1] -> 3434 | AJ50: =1+RC[-1] -> 3435 | AK50: =1+RC[-1] -> 3436 | AL50: =1+RC[-1] -> 3437 | AM50: =1+RC[-1] -> 3438 | AN50: =1+RC[-1] -> 3439 | AO50: =1+RC[-1] -> 3440 | AP50: =1+RC[-1] -> 3441 | AQ50: =1+RC[-1] -> 3442 | AR50: =1+RC[-1] -> 3443 | AS50: =1+RC[-1] -> 3444 | AT50: =1+RC[-1] -> 3445 | AU50: =1+RC[-1] -> 3446 | AV50: =1+RC[-1] -> 3447 | AW50: =1+RC[-1] -> 3448 | AX50: =1+RC[-1] -> 3449 | AY50: =1+RC[-1] -> 3450 | AZ50: =1+RC[-1] -> 3451 | BA50: =1+RC[-1] -> 3452 | BB50: =1+RC[-1] -> 3453 | BC50: =1+RC[-1] -> 3454 | BD50: =1+RC[-1] -> 3455 | BE50: =1+RC[-1] -> 3456 | BF50: =1+RC[-1] -> 3457 | BG50: =1+RC[-1] -> 3458 | BH50: =1+RC[-1] -> 3459 | BI50: =1+RC[-1] -> 3460 | BJ50: =1+RC[-1] -> 3461 | BK50: =1+RC[-1] -> 3462 | BL50: =1+RC[-1] -> 3463 | BM50: =1+RC[-1] -> 3464 | BN50: =1+RC[-1] -> 3465 | BO50: =1+RC[-1] -> 3466 | BP50: =1+RC[-1] -> 3467 | BQ50: =1+RC[-1] -> 3468 | BR50: =1+RC[-1] -> 3469 | BS50: =1+RC[-1] -> 3470 | BT50: =1+RC[-1] -> 3471 | BU50: =1+RC[-1] -> 3472 | BV50: =1+RC[-1] -> 3473 | BW50: =1+RC[-1] -> 3474 | BX50: =1+RC[-1] -> 3475 | BY50: =1+RC[-1] -> 3476 | BZ50: =1+RC[-1] -> 3477 | CA50: =1+RC[-1] -> 3478 | CB50: =1+RC[-1] -> 3479 | CC50: =1+RC[-1] -> 3480 | CD50: =1+RC[-1] -> 3481 | CE50: =1+RC[-1] -> 3482 | CF50: =1+RC[-1] -> 3483 | CG50: =1+RC[-1] -> 3484 | CH50: =1+RC[-1] -> 3485 | CI50: =1+RC[-1] -> 3486 | CJ50: =1+RC[-1] -> 3487 | CK50: =1+RC[-1] -> 3488 | CL50: =1+RC[-1] -> 3489 | CM50: =1+RC[-1] -> 3490 | CN50: =1+RC[-1] -> 3491 | CO50: =1+RC[-1] -> 3492 | CP50: =1+RC[-1] -> 3493 | CQ50: =1+RC[-1] -> 3494 | CR50: =1+RC[-1] -> 3495 | CS50: =1+RC[-1] -> 3496 | CT50: =1+RC[-1] -> 3497 | CU50: =1+RC[-1] -> 3498 | CV50: =1+RC[-1] -> 3499 | CW50: =1+RC[-1] -> 3500
B51: =R[-1]C[99]+1 -> 3501 | C51: =1+RC[-1] -> 3502 | D51: =1+RC[-1] -> 3503 | E51: =1+RC[-1] -> 3504 | F51: =1+RC[-1] -> 3505 | G51: =1+RC[-1] -> 3506 | H51: =1+RC[-1] -> 3507 | I51: =1+RC[-1] -> 3508 | J51: =1+RC[-1] -> 3509 | K51: =1+RC[-1] -> 3510 | L51: =1+RC[-1] -> 3511 | M51: =1+RC[-1] -> 3512 | N51: =1+RC[-1] -> 3513 | O51: =1+RC[-1] -> 3514 | P51: =1+RC[-1] -> 3515 | Q51: =1+RC[-1] -> 3516 | R51: =1+RC[-1] -> 3517 | S51: =1+RC[-1] -> 3518 | T51: =1+RC[-1] -> 3519 | U51: =1+RC[-1] -> 3520 | V51: =1+RC[-1] -> 3521 | W51: =1+RC[-1] -> 3522 | X51: =1+RC[-1] -> 3523 | Y51: =1+RC[-1] -> 3524 | Z51: =1+RC[-1] -> 3525 | AA51: =1+RC[-1] -> 3526 | AB51: =1+RC[-1] -> 3527 | AC51: =1+RC[-1] -> 3528 | AD51: =1+RC[-1] -> 3529 | AE51: =1+RC[-1] -> 3530 | AF51: =1+RC[-1] -> 3531 | AG51: =1+RC[-1] -> 3532 | AH51: =1+RC[-1] -> 3533 | AI51: =1+RC[-1] -> 3534 | AJ51: =1+RC[-1] -> 3535 | AK51: =1+RC[-1] -> 3536 | AL51: =1+RC[-1] -> 3537 | AM51: =1+RC[-1] -> 3538 | AN51: =1+RC[-1] -> 3539 | AO51: =1+RC[-1] -> 3540 | AP51: =1+RC[-1] -> 3541 | AQ51: =1+RC[-1] -> 3542 | AR51: =1+RC[-1] -> 3543 | AS51: =1+RC[-1] -> 3544 | AT51: =1+RC[-1] -> 3545 | AU51: =1+RC[-1] -> 3546 | AV51: =1+RC[-1] -> 3547 | AW51: =1+RC[-1] -> 3548 | AX51: =1+RC[-1] -> 3549 | AY51: =1+RC[-1] -> 3550 | AZ51: =1+RC[-1] -> 3551 | BA51: =1+RC[-1] -> 3552 | BB51: =1+RC[-1] -> 3553 | BC51: =1+RC[-1] -> 3554 | BD51: =1+RC[-1] -> 3555 | BE51: =1+RC[-1] -> 3556 | BF51: =1+RC[-1] -> 3557 | BG51: =1+RC[-1] -> 3558 | BH51: =1+RC[-1] -> 3559 | BI51: =1+RC[-1] -> 3560 | BJ51: =1+RC[-1] -> 3561 | BK51: =1+RC[-1] -> 3562 | BL51: =1+RC[-1] -> 3563 | BM51: =1+RC[-1] -> 3564 | BN51: =1+RC[-1] -> 3565 | BO51: =1+RC[-1] -> 3566 | BP51: =1+RC[-1] -> 3567 | BQ51: =1+RC[-1] -> 3568 | BR51: =1+RC[-1] -> 3569 | BS51: =1+RC[-1] -> 3570 | BT51: =1+RC[-1] -> 3571 | BU51: =1+RC[-1] -> 3572 | BV51: =1+RC[-1] -> 3573 | BW51: =1+RC[-1] -> 3574 | BX51: =1+RC[-1] -> 3575 | BY51: =1+RC[-1] -> 3576 | BZ51: =1+RC[-1] -> 3577 | CA51: =1+RC[-1] -> 3578 | CB51: =1+RC[-1] -> 3579 | CC51: =1+RC[-1] -> 3580 | CD51: =1+RC[-1] -> 3581 | CE51: =1+RC[-1] -> 3582 | CF51: =1+RC[-1] -> 3583 | CG51: =1+RC[-1] -> 3584 | CH51: =1+RC[-1] -> 3585 | CI51: =1+RC[-1] -> 3586 | CJ51: =1+RC[-1] -> 3587 | CK51: =1+RC[-1] -> 3588 | CL51: =1+RC[-1] -> 3589 | CM51: =1+RC[-1] -> 3590 | CN51: =1+RC[-1] -> 3591 | CO51: =1+RC[-1] -> 3592 | CP51: =1+RC[-1] -> 3593 | CQ51: =1+RC[-1] -> 3594 | CR51: =1+RC[-1] -> 3595 | CS51: =1+RC[-1] -> 3596 | CT51: =1+RC[-1] -> 3597 | CU51: =1+RC[-1] -> 3598 | CV51: =1+RC[-1] -> 3599 | CW51: =1+RC[-1] -> 3600
B52: =R[-1]C[99]+1 -> 3601 | C52: =1+RC[-1] -> 3602 | D52: =1+RC[-1] -> 3603 | E52: =1+RC[-1] -> 3604 | F52: =1+RC[-1] -> 3605 | G52: =1+RC[-1] -> 3606 | H52: =1+RC[-1] -> 3607 | I52: =1+RC[-1] -> 3608 | J52: =1+RC[-1] -> 3609 | K52: =1+RC[-1] -> 3610 | L52: =1+RC[-1] -> 3611 | M52: =1+RC[-1] -> 3612 | N52: =1+RC[-1] -> 3613 | O52: =1+RC[-1] -> 3614 | P52: =1+RC[-1] -> 3615 | Q52: =1+RC[-1] -> 3616 | R52: =1+RC[-1] -> 3617 | S52: =1+RC[-1] -> 3618 | T52: =1+RC[-1] -> 3619 | U52: =1+RC[-1] -> 3620 | V52: =1+RC[-1] -> 3621 | W52: =1+RC[-1] -> 3622 | X52: =1+RC[-1] -> 3623 | Y52: =1+RC[-1] -> 3624 | Z52: =1+RC[-1] -> 3625 | AA52: =1+RC[-1] -> 3626 | AB52: =1+RC[-1] -> 3627 | AC52: =1+RC[-1] -> 3628 | AD52: =1+RC[-1] -> 3629 | AE52: =1+RC[-1] -> 3630 | AF52: =1+RC[-1] -> 3631 | AG52: =1+RC[-1] -> 3632 | AH52: =1+RC[-1] -> 3633 | AI52: =1+RC[-1] -> 3634 | AJ52: =1+RC[-1] -> 3635 | AK52: =1+RC[-1] -> 3636 | AL52: =1+RC[-1] -> 3637 | AM52: =1+RC[-1] -> 3638 | AN52: =1+RC[-1] -> 3639 | AO52: =1+RC[-1] -> 3640 | AP52: =1+RC[-1] -> 3641 | AQ52: =1+RC[-1] -> 3642 | AR52: =1+RC[-1] -> 3643 | AS52: =1+RC[-1] -> 3644 | AT52: =1+RC[-1] -> 3645 | AU52: =1+RC[-1] -> 3646 | AV52: =1+RC[-1] -> 3647 | AW52: =1+RC[-1] -> 3648 | AX52: =1+RC[-1] -> 3649 | AY52: =1+RC[-1] -> 3650 | AZ52: =1+RC[-1] -> 3651 | BA52: =1+RC[-1] -> 3652 | BB52: =1+RC[-1] -> 3653 | BC52: =1+RC[-1] -> 3654 | BD52: =1+RC[-1] -> 3655 | BE52: =1+RC[-1] -> 3656 | BF52: =1+RC[-1] -> 3657 | BG52: =1+RC[-1] -> 3658 | BH52: =1+RC[-1] -> 3659 | BI52: =1+RC[-1] -> 3660 | BJ52: =1+RC[-1] -> 3661 | BK52: =1+RC[-1] -> 3662 | BL52: =1+RC[-1] -> 3663 | BM52: =1+RC[-1] -> 3664 | BN52: =1+RC[-1] -> 3665 | BO52: =1+RC[-1] -> 3666 | BP52: =1+RC[-1] -> 3667 | BQ52: =1+RC[-1] -> 3668 | BR52: =1+RC[-1] -> 3669 | BS52: =1+RC[-1] -> 3670 | BT52: =1+RC[-1] -> 3671 | BU52: =1+RC[-1] -> 3672 | BV52: =1+RC[-1] -> 3673 | BW52: =1+RC[-1] -> 3674 | BX52: =1+RC[-1] -> 3675 | BY52: =1+RC[-1] -> 3676 | BZ52: =1+RC[-1] -> 3677 | CA52: =1+RC[-1] -> 3678 | CB52: =1+RC[-1] -> 3679 | CC52: =1+RC[-1] -> 3680 | CD52: =1+RC[-1] -> 3681 | CE52: =1+RC[-1] -> 3682 | CF52: =1+RC[-1] -> 3683 | CG52: =1+RC[-1] -> 3684 | CH52: =1+RC[-1] -> 3685 | CI52: =1+RC[-1] -> 3686 | CJ52: =1+RC[-1] -> 3687 | CK52: =1+RC[-1] -> 3688 | CL52: =1+RC[-1] -> 3689 | CM52: =1+RC[-1] -> 3690 | CN52: =1+RC[-1] -> 3691 | CO52: =1+RC[-1] -> 3692 | CP52: =1+RC[-1] -> 3693 | CQ52: =1+RC[-1] -> 3694 | CR52: =1+RC[-1] -> 3695 | CS52: =1+RC[-1] -> 3696 | CT52: =1+RC[-1] -> 3697 | CU52: =1+RC[-1] -> 3698 | CV52: =1+RC[-1] -> 3699 | CW52: =1+RC[-1] -> 3700
B53: =R[-1]C[99]+1 -> 3701 | C53: =1+RC[-1] -> 3702 | D53: =1+RC[-1] -> 3703 | E53: =1+RC[-1] -> 3704 | F53: =1+RC[-1] -> 3705 | G53: =1+RC[-1] -> 3706 | H53: =1+RC[-1] -> 3707 | I53: =1+RC[-1] -> 3708 | J53: =1+RC[-1] -> 3709 | K53: =1+RC[-1] -> 3710 | L53: =1+RC[-1] -> 3711 | M53: =1+RC[-1] -> 3712 | N53: =1+RC[-1] -> 3713 | O53: =1+RC[-1] -> 3714 | P53: =1+RC[-1] -> 3715 | Q53: =1+RC[-1] -> 3716 | R53: =1+RC[-1] -> 3717 | S53: =1+RC[-1] -> 3718 | T53: =1+RC[-1] -> 3719 | U53: =1+RC[-1] -> 3720 | V53: =1+RC[-1] -> 3721 | W53: =1+RC[-1] -> 3722 | X53: =1+RC[-1] -> 3723 | Y53: =1+RC[-1] -> 3724 | Z53: =1+RC[-1] -> 3725 | AA53: =1+RC[-1] -> 3726 | AB53: =1+RC[-1] -> 3727 | AC53: =1+RC[-1] -> 3728 | AD53: =1+RC[-1] -> 3729 | AE53: =1+RC[-1] -> 3730 | AF53: =1+RC[-1] -> 3731 | AG53: =1+RC[-1] -> 3732 | AH53: =1+RC[-1] -> 3733 | AI53: =1+RC[-1] -> 3734 | AJ53: =1+RC[-1] -> 3735 | AK53: =1+RC[-1] -> 3736 | AL53: =1+RC[-1] -> 3737 | AM53: =1+RC[-1] -> 3738 | AN53: =1+RC[-1] -> 3739 | AO53: =1+RC[-1] -> 3740 | AP53: =1+RC[-1] -> 3741 | AQ53: =1+RC[-1] -> 3742 | AR53: =1+RC[-1] -> 3743 | AS53: =1+RC[-1] -> 3744 | AT53: =1+RC[-1] -> 3745 | AU53: =1+RC[-1] -> 3746 | AV53: =1+RC[-1] -> 3747 | AW53: =1+RC[-1] -> 3748 | AX53: =1+RC[-1] -> 3749 | AY53: =1+RC[-1] -> 3750 | AZ53: =1+RC[-1] -> 3751 | BA53: =1+RC[-1] -> 3752 | BB53: =1+RC[-1] -> 3753 | BC53: =1+RC[-1] -> 3754 | BD53: =1+RC[-1] -> 3755 | BE53: =1+RC[-1] -> 3756 | BF53: =1+RC[-1] -> 3757 | BG53: =1+RC[-1] -> 3758 | BH53: =1+RC[-1] -> 3759 | BI53: =1+RC[-1] -> 3760 | BJ53: =1+RC[-1] -> 3761 | BK53: =1+RC[-1] -> 3762 | BL53: =1+RC[-1] -> 3763 | BM53: =1+RC[-1] -> 3764 | BN53: =1+RC[-1] -> 3765 | BO53: =1+RC[-1] -> 3766 | BP53: =1+RC[-1] -> 3767 | BQ53: =1+RC[-1] -> 3768 | BR53: =1+RC[-1] -> 3769 | BS53: =1+RC[-1] -> 3770 | BT53: =1+RC[-1] -> 3771 | BU53: =1+RC[-1] -> 3772 | BV53: =1+RC[-1] -> 3773 | BW53: =1+RC[-1] -> 3774 | BX53: =1+RC[-1] -> 3775 | BY53: =1+RC[-1] -> 3776 | BZ53: =1+RC[-1] -> 3777 | CA53: =1+RC[-1] -> 3778 | CB53: =1+RC[-1] -> 3779 | CC53: =1+RC[-1] -> 3780 | CD53: =1+RC[-1] -> 3781 | CE53: =1+RC[-1] -> 3782 | CF53: =1+RC[-1] -> 3783 | CG53: =1+RC[-1] -> 3784 | CH53: =1+RC[-1] -> 3785 | CI53: =1+RC[-1] -> 3786 | CJ53: =1+RC[-1] -> 3787 | CK53: =1+RC[-1] -> 3788 | CL53: =1+RC[-1] -> 3789 | CM53: =1+RC[-1] -> 3790 | CN53: =1+RC[-1] -> 3791 | CO53: =1+RC[-1] -> 3792 | CP53: =1+RC[-1] -> 3793 | CQ53: =1+RC[-1] -> 3794 | CR53: =1+RC[-1] -> 3795 | CS53: =1+RC[-1] -> 3796 | CT53: =1+RC[-1] -> 3797 | CU53: =1+RC[-1] -> 3798 | CV53: =1+RC[-1] -> 3799 | CW53: =1+RC[-1] -> 3800
B54: =R[-1]C[99]+1 -> 3801 | C54: =1+RC[-1] -> 3802 | D54: =1+RC[-1] -> 3803 | E54: =1+RC[-1] -> 3804 | F54: =1+RC[-1] -> 3805 | G54: =1+RC[-1] -> 3806 | H54: =1+RC[-1] -> 3807 | I54: =1+RC[-1] -> 3808 | J54: =1+RC[-1] -> 3809 | K54: =1+RC[-1] -> 3810 | L54: =1+RC[-1] -> 3811 | M54: =1+RC[-1] -> 3812 | N54: =1+RC[-1] -> 3813 | O54: =1+RC[-1] -> 3814 | P54: =1+RC[-1] -> 3815 | Q54: =1+RC[-1] -> 3816 | R54: =1+RC[-1] -> 3817 | S54: =1+RC[-1] -> 3818 | T54: =1+RC[-1] -> 3819 | U54: =1+RC[-1] -> 3820 | V54: =1+RC[-1] -> 3821 | W54: =1+RC[-1] -> 3822 | X54: =1+RC[-1] -> 3823 | Y54: =1+RC[-1] -> 3824 | Z54: =1+RC[-1] -> 3825 | AA54: =1+RC[-1] -> 3826 | AB54: =1+RC[-1] -> 3827 | AC54: =1+RC[-1] -> 3828 | AD54: =1+RC[-1] -> 3829 | AE54: =1+RC[-1] -> 3830 | AF54: =1+RC[-1] -> 3831 | AG54: =1+RC[-1] -> 3832 | AH54: =1+RC[-1] -> 3833 | AI54: =1+RC[-1] -> 3834 | AJ54: =1+RC[-1] -> 3835 | AK54: =1+RC[-1] -> 3836 | AL54: =1+RC[-1] -> 3837 | AM54: =1+RC[-1] -> 3838 | AN54: =1+RC[-1] -> 3839 | AO54: =1+RC[-1] -> 3840 | AP54: =1+RC[-1] -> 3841 | AQ54: =1+RC[-1] -> 3842 | AR54: =1+RC[-1] -> 3843 | AS54: =1+RC[-1] -> 3844 | AT54: =1+RC[-1] -> 3845 | AU54: =1+RC[-1] -> 3846 | AV54: =1+RC[-1] -> 3847 | AW54: =1+RC[-1] -> 3848 | AX54: =1+RC[-1] -> 3849 | AY54: =1+RC[-1] -> 3850 | AZ54: =1+RC[-1] -> 3851 | BA54: =1+RC[-1] -> 3852 | BB54: =1+RC[-1] -> 3853 | BC54: =1+RC[-1] -> 3854 | BD54: =1+RC[-1] -> 3855 | BE54: =1+RC[-1] -> 3856 | BF54: =1+RC[-1] -> 3857 | BG54: =1+RC[-1] -> 3858 | BH54: =1+RC[-1] -> 3859 | BI54: =1+RC[-1] -> 3860 | BJ54: =1+RC[-1] -> 3861 | BK54: =1+RC[-1] -> 3862 | BL54: =1+RC[-1] -> 3863 | BM54: =1+RC[-1] -> 3864 | BN54: =1+RC[-1] -> 3865 | BO54: =1+RC[-1] -> 3866 | BP54: =1+RC[-1] -> 3867 | BQ54: =1+RC[-1] -> 3868 | BR54: =1+RC[-1] -> 3869 | BS54: =1+RC[-1] -> 3870 | BT54: =1+RC[-1] -> 3871 | BU54: =1+RC[-1] -> 3872 | BV54: =1+RC[-1] -> 3873 | BW54: =1+RC[-1] -> 3874 | BX54: =1+RC[-1] -> 3875 | BY54: =1+RC[-1] -> 3876 | BZ54: =1+RC[-1] -> 3877 | CA54: =1+RC[-1] -> 3878 | CB54: =1+RC[-1] -> 3879 | CC54: =1+RC[-1] -> 3880 | CD54: =1+RC[-1] -> 3881 | CE54: =1+RC[-1] -> 3882 | CF54: =1+RC[-1] -> 3883 | CG54: =1+RC[-1] -> 3884 | CH54: =1+RC[-1] -> 3885 | CI54: =1+RC[-1] -> 3886 | CJ54: =1+RC[-1] -> 3887 | CK54: =1+RC[-1] -> 3888 | CL54: =1+RC[-1] -> 3889 | CM54: =1+RC[-1] -> 3890 | CN54: =1+RC[-1] -> 3891 | CO54: =1+RC[-1] -> 3892 | CP54: =1+RC[-1] -> 3893 | CQ54: =1+RC[-1] -> 3894 | CR54: =1+RC[-1] -> 3895 | CS54: =1+RC[-1] -> 3896 | CT54: =1+RC[-1] -> 3897 | CU54: =1+RC[-1] -> 3898 | CV54: =1+RC[-1] -> 3899 | CW54: =1+RC[-1] -> 3900
B55: =R[-1]C[99]+1 -> 3901 | C55: =1+RC[-1] -> 3902 | D55: =1+RC[-1] -> 3903 | E55: =1+RC[-1] -> 3904 | F55: =1+RC[-1] -> 3905 | G55: =1+RC[-1] -> 3906 | H55: =1+RC[-1] -> 3907 | I55: =1+RC[-1] -> 3908 | J55: =1+RC[-1] -> 3909 | K55: =1+RC[-1] -> 3910 | L55: =1+RC[-1] -> 3911 | M55: =1+RC[-1] -> 3912 | N55: =1+RC[-1] -> 3913 | O55: =1+RC[-1] -> 3914 | P55: =1+RC[-1] -> 3915 | Q55: =1+RC[-1] -> 3916 | R55: =1+RC[-1] -> 3917 | S55: =1+RC[-1] -> 3918 | T55: =1+RC[-1] -> 3919 | U55: =1+RC[-1] -> 3920 | V55: =1+RC[-1] -> 3921 | W55: =1+RC[-1] -> 3922 | X55: =1+RC[-1] -> 3923 | Y55: =1+RC[-1] -> 3924 | Z55: =1+RC[-1] -> 3925 | AA55: =1+RC[-1] -> 3926 | AB55: =1+RC[-1] -> 3927 | AC55: =1+RC[-1] -> 3928 | AD55: =1+RC[-1] -> 3929 | AE55: =1+RC[-1] -> 3930 | AF55: =1+RC[-1] -> 3931 | AG55: =1+RC[-1] -> 3932 | AH55: =1+RC[-1] -> 3933 | AI55: =1+RC[-1] -> 3934 | AJ55: =1+RC[-1] -> 3935 | AK55: =1+RC[-1] -> 3936 | AL55: =1+RC[-1] -> 3937 | AM55: =1+RC[-1] -> 3938 | AN55: =1+RC[-1] -> 3939 | AO55: =1+RC[-1] -> 3940 | AP55: =1+RC[-1] -> 3941 | AQ55: =1+RC[-1] -> 3942 | AR55: =1+RC[-1] -> 3943 | AS55: =1+RC[-1] -> 3944 | AT55: =1+RC[-1] -> 3945 | AU55: =1+RC[-1] -> 3946 | AV55: =1+RC[-1] -> 3947 | AW55: =1+RC[-1] -> 3948 | AX55: =1+RC[-1] -> 3949 | AY55: =1+RC[-1] -> 3950 | AZ55: =1+RC[-1] -> 3951 | BA55: =1+RC[-1] -> 3952 | BB55: =1+RC[-1] -> 3953 | BC55: =1+RC[-1] -> 3954 | BD55: =1+RC[-1] -> 3955 | BE55: =1+RC[-1] -> 3956 | BF55: =1+RC[-1] -> 3957 | BG55: =1+RC[-1] -> 3958 | BH55: =1+RC[-1] -> 3959 | BI55: =1+RC[-1] -> 3960 | BJ55: =1+RC[-1] -> 3961 | BK55: =1+RC[-1] -> 3962 | BL55: =1+RC[-1] -> 3963 | BM55: =1+RC[-1] -> 3964 | BN55: =1+RC[-1] -> 3965 | BO55: =1+RC[-1] -> 3966 | BP55: =1+RC[-1] -> 3967 | BQ55: =1+RC[-1] -> 3968 | BR55: =1+RC[-1] -> 3969 | BS55: =1+RC[-1] -> 3970 | BT55: =1+RC[-1] -> 3971 | BU55: =1+RC[-1] -> 3972 | BV55: =1+RC[-1] -> 3973 | BW55: =1+RC[-1] -> 3974 | BX55: =1+RC[-1] -> 3975 | BY55: =1+RC[-1] -> 3976 | BZ55: =1+RC[-1] -> 3977 | CA55: =1+RC[-1] -> 3978 | CB55: =1+RC[-1] -> 3979 | CC55: =1+RC[-1] -> 3980 | CD55: =1+RC[-1] -> 3981 | CE55: =1+RC[-1] -> 3982 | CF55: =1+RC[-1] -> 3983 | CG55: =1+RC[-1] -> 3984 | CH55: =1+RC[-1] -> 3985 | CI55: =1+RC[-1] -> 3986 | CJ55: =1+RC[-1] -> 3987 | CK55: =1+RC[-1] -> 3988 | CL55: =1+RC[-1] -> 3989 | CM55: =1+RC[-1] -> 3990 | CN55: =1+RC[-1] -> 3991 | CO55: =1+RC[-1] -> 3992 | CP55: =1+RC[-1] -> 3993 | CQ55: =1+RC[-1] -> 3994 | CR55: =1+RC[-1] -> 3995 | CS55: =1+RC[-1] -> 3996 | CT55: =1+RC[-1] -> 3997 | CU55: =1+RC[-1] -> 3998 | CV55: =1+RC[-1] -> 3999 | CW55: =1+RC[-1] -> 4000
B56: =R[-1]C[99]+1 -> 4001 | C56: =1+RC[-1] -> 4002 | D56: =1+RC[-1] -> 4003 | E56: =1+RC[-1] -> 4004 | F56: =1+RC[-1] -> 4005 | G56: =1+RC[-1] -> 4006 | H56: =1+RC[-1] -> 4007 | I56: =1+RC[-1] -> 4008 | J56: =1+RC[-1] -> 4009 | K56: =1+RC[-1] -> 4010 | L56: =1+RC[-1] -> 4011 | M56: =1+RC[-1] -> 4012 | N56: =1+RC[-1] -> 4013 | O56: =1+RC[-1] -> 4014 | P56: =1+RC[-1] -> 4015 | Q56: =1+RC[-1] -> 4016 | R56: =1+RC[-1] -> 4017 | S56: =1+RC[-1] -> 4018 | T56: =1+RC[-1] -> 4019 | U56: =1+RC[-1] -> 4020 | V56: =1+RC[-1] -> 4021 | W56: =1+RC[-1] -> 4022 | X56: =1+RC[-1] -> 4023 | Y56: =1+RC[-1] -> 4024 | Z56: =1+RC[-1] -> 4025 | AA56: =1+RC[-1] -> 4026 | AB56: =1+RC[-1] -> 4027 | AC56: =1+RC[-1] -> 4028 | AD56: =1+RC[-1] -> 4029 | AE56: =1+RC[-1] -> 4030 | AF56: =1+RC[-1] -> 4031 | AG56: =1+RC[-1] -> 4032 | AH56: =1+RC[-1] -> 4033 | AI56: =1+RC[-1] -> 4034 | AJ56: =1+RC[-1] -> 4035 | AK56: =1+RC[-1] -> 4036 | AL56: =1+RC[-1] -> 4037 | AM56: =1+RC[-1] -> 4038 | AN56: =1+RC[-1] -> 4039 | AO56: =1+RC[-1] -> 4040 | AP56: =1+RC[-1] -> 4041 | AQ56: =1+RC[-1] -> 4042 | AR56: =1+RC[-1] -> 4043 | AS56: =1+RC[-1] -> 4044 | AT56: =1+RC[-1] -> 4045 | AU56: =1+RC[-1] -> 4046 | AV56: =1+RC[-1] -> 4047 | AW56: =1+RC[-1] -> 4048 | AX56: =1+RC[-1] -> 4049 | AY56: =1+RC[-1] -> 4050 | AZ56: =1+RC[-1] -> 4051 | BA56: =1+RC[-1] -> 4052 | BB56: =1+RC[-1] -> 4053 | BC56: =1+RC[-1] -> 4054 | BD56: =1+RC[-1] -> 4055 | BE56: =1+RC[-1] -> 4056 | BF56: =1+RC[-1] -> 4057 | BG56: =1+RC[-1] -> 4058 | BH56: =1+RC[-1] -> 4059 | BI56: =1+RC[-1] -> 4060 | BJ56: =1+RC[-1] -> 4061 | BK56: =1+RC[-1] -> 4062 | BL56: =1+RC[-1] -> 4063 | BM56: =1+RC[-1] -> 4064 | BN56: =1+RC[-1] -> 4065 | BO56: =1+RC[-1] -> 4066 | BP56: =1+RC[-1] -> 4067 | BQ56: =1+RC[-1] -> 4068 | BR56: =1+RC[-1] -> 4069 | BS56: =1+RC[-1] -> 4070 | BT56: =1+RC[-1] -> 4071 | BU56: =1+RC[-1] -> 4072 | BV56: =1+RC[-1] -> 4073 | BW56: =1+RC[-1] -> 4074 | BX56: =1+RC[-1] -> 4075 | BY56: =1+RC[-1] -> 4076 | BZ56: =1+RC[-1] -> 4077 | CA56: =1+RC[-1] -> 4078 | CB56: =1+RC[-1] -> 4079 | CC56: =1+RC[-1] -> 4080 | CD56: =1+RC[-1] -> 4081 | CE56: =1+RC[-1] -> 4082 | CF56: =1+RC[-1] -> 4083 | CG56: =1+RC[-1] -> 4084 | CH56: =1+RC[-1] -> 4085 | CI56: =1+RC[-1] -> 4086 | CJ56: =1+RC[-1] -> 4087 | CK56: =1+RC[-1] -> 4088 | CL56: =1+RC[-1] -> 4089 | CM56: =1+RC[-1] -> 4090 | CN56: =1+RC[-1] -> 4091 | CO56: =1+RC[-1] -> 4092 | CP56: =1+RC[-1] -> 4093 | CQ56: =1+RC[-1] -> 4094 | CR56: =1+RC[-1] -> 4095 | CS56: =1+RC[-1] -> 4096